file_name,uni,wylie,url,dept,grade,char_len,audio_len,path,inf
STT_NW0029_0001_16725_to_26094,བོད་རྒྱལ་ལོ་ཉིས་སྟོང་བརྒྱ་དང་བཞི་ཅུ་ཞེ་གསུམ་རབ་གནས་མེ་སྤྲེའུ་ལོའི་བོད་ཟླ་བཅུ་བ། སྨིན་དྲུག་ཟླ་བའི་གནམ་གང་དང་། ཕྱི་ལོ་གཉིས་སྟོང་བཅུ་དྲུག་ལོའི་ཟླ་བ་བཅུ་གཉིས་པའི་ཚེས་པ་ཉི་ཤུ་རྩ་བརྒྱད་གཟའ་ལྷག་པའི་ལས་རིམ་ནང་དུ།  ,bod rgyal lo nyis stong brgya dang bzhi cu zhe gsum rab gnas me spre'u lo'i bod zla bcu ba/_smin drug zla ba'i gnam gang dang /_phyi lo gnyis stong bcu drug lo'i zla ba bcu gnyis pa'i tshes pa nyi shu rtsa brgyad gza' lhag pa'i las rim nang du/__,https://d38pmlk0v88drf.cloudfront.net/wav16k/STT_NW0029_0001_16725_to_26094.wav,STT_NW,2,206,9.369,wav16k/STT_NW0029_0001_16725_to_26094.wav,བོད་རྒྱལ་ལོ་ཉིས་སྟོང་བརྒྱ་དང་བཞི་བཅུ་ཞེ་གསུམ་རབ་གནས་མེ་གྲེལ་ལོའི་བོད་ཟླ་བཅུ་པ་སྨིན་དྲུག་ཟླ་བའི་གནམ་གང་དང་ཕྱི་ལོ་ཉིས་སྟོང་བཅུ་དྲུག་ལོའི་ཟླ་བ་བཅུ་གཉིས་པའི་ཚེས་པ་ཉི་ཤུ་རྩ་བརྒྱད་གཟའ་ལྷག་པའི་ལས་རིམ་གནང་འདུག་
STT_NW0029_0002_26094_to_29487,ཉེ་ཆར་གློད་གྲོལ་བྱུང་བའི་ཆབ་སྲིད་བཙོན་ཟུར་འཇིགས་མེད་རྒྱ་མཚོ་ལགས།  ,nye char glod grol byung ba'i chab srid btson zur 'jigs med rgya mtsho lags/__,https://d38pmlk0v88drf.cloudfront.net/wav16k/STT_NW0029_0002_26094_to_29487.wav,STT_NW,2,66,3.393,wav16k/STT_NW0029_0002_26094_to_29487.wav,ཉེ་ཆར་གློད་གྲོལ་བྱུང་བའི་ཆབ་སྲིད་བཙོན་ཟུར་འཇིགས་མེད་རྒྱ་མཚོ་ལགས།
STT_NW0029_0003_29487_to_36889,ནད་གཞི་སྣ་མང་ཕོག་པའི་ཁར་ལ་རྒྱ་ནག་གཞུང་ནས་ཁོང་ལ་མུ་མཐུད་ལྟ་སྲུང་གི་སྨན་བཅོས་སོགས་ཀི་ཐོབ་ཐང་མེད་པའི་དཀའ་ངལ་འཕྲད་བཞིན་པའི་གནས་ཚུལ་ཞིག་ཐོན་འདུག།  ,nad gzhi sna mang phog pa'i khar la rgya nag gzhung nas khong la mu mthud lta srung gi sman bcos sogs ki thob thang med pa'i dka' ngal 'phrad bzhin pa'i gnas tshul zhig thon 'dug/__,https://d38pmlk0v88drf.cloudfront.net/wav16k/STT_NW0029_0003_29487_to_36889.wav,STT_NW,2,142,7.402,wav16k/STT_NW0029_0003_29487_to_36889.wav,ནད་གཞི་རྣ་མང་ཕོག་པའི་ཁར་ལ་རྒྱ་ནག་གཞུང་ནས་ཁོང་ལ་མུ་མཐུད་ལྟ་བཟུང་གི་སྨན་བཅོས་སོགས་ཀི་ཐོབ་ཐང་མེད་པའི་དཀའ་ངལ་འཕྲད་བཞིན་པའི་གནས་ཚུལ་ཞིག་ཐོན་འདུག
STT_MV0483_0012_182054_to_187025,མ་གྷ་དྷའི་རྒྱལ་པོས་དེ་འདྲས་ཁྱོན་ནས་གནང་སྲིད་ཀི་མ་རེད། ང་ཚོའི་དགྲ་བོ་དང་།  ,ma g+ha d+ha'i rgyal pos de 'dras khyon nas gnang srid ki ma red/_nga tsho'i dgra bo dang /__,https://d38pmlk0v88drf.cloudfront.net/wav16k/STT_MV0483_0012_182054_to_187025.wav,STT_MV,2,74,4.971,wav16k/STT_MV0483_0012_182054_to_187025.wav,མ་གྷ་ལྷའི་རྒྱལ་པོས་འདེ་འདྲས་ཁྱོན་ནས་གནང་སྲིད་ཀི་མ་རེད། ང་ཚོའི་དགྲ་བོ་དང་།
STT_NW0029_0004_36889_to_46581,ད་ག་ནང་བཞིན་བོད་མདོ་སྨད་ཀན་སུའུ་ཞིང་ཆེན་ཀན་ལྷོ་ཁུལ་རྔོག་རྒྱལ་མོ་དགོན་གྱི་དགེ་འདུན་པ་ཞིག་ཀྱང་རྒྱ་ནག་གཞུང་གི་ཉེས་རྟོག་མི་སྣས་གློ་བུར་ཏུ་འཛིན་བཟུང་བཙན་ཁྲིད་བྱས་པའི་གནས་ཚུལ་ཞིག་ཀྱང་ཐོན་ཤག།  ,da ga nang bzhin bod mdo smad kan su'u zhing chen kan lho khul rngog rgyal mo dgon gyi dge 'dun pa zhig kyang rgya nag gzhung gi nyes rtog mi snas glo bur tu 'dzin bzung btsan khrid byas pa'i gnas tshul zhig kyang thon shag/__,https://d38pmlk0v88drf.cloudfront.net/wav16k/STT_NW0029_0004_36889_to_46581.wav,STT_NW,2,186,9.692,wav16k/STT_NW0029_0004_36889_to_46581.wav,ད་ག་ནང་བཞིན་བོད་སདོན་སྨད་ཀན་ཟུ་ཞིང་ཆེན་ཀན་ལོ་ཁུལ་སྔོག་རྒྱལ་མོ་མགོན་གི་དགེ་འདུན་པ་ཞིག་ཀྱང་རྒྱ་ནག་གཞུང་གི་ཉེན་རྟོག་མི་སྣས་གློ་བུར་དུ་འཛིན་བཟུང་བཙན་ཁྲིད་བྱས་པའི་གནས་ཚུལ་ཞིག་ཀྱང་ཐོན་ཤག
STT_NW0029_0005_46581_to_53706,བཙན་བྱོལ་བོད་མིའི་གཏན་ཉིན་སློབ་གྲྭ་ཁག་གི་སློབ་ཕྲུག་ཚོ་ལ་འགོ་ཁྲིད་ནུས་པ་སྐྱེད་སྲིང་གནང་ཕྱོགས་དང་འབྲེལ་བའི་ཟབ་སྦྱོང་ཐེངས་བཞི་བ་དེ་མཇུལ་བསྒྲིལ་འདུག།  ,btsan byol bod mi'i gtan nyin slob grwa khag gi slob phrug tsho la 'go khrid nus pa skyed sring gnang phyogs dang 'brel ba'i zab sbyong thengs bzhi ba de mjul bsgril 'dug/__,https://d38pmlk0v88drf.cloudfront.net/wav16k/STT_NW0029_0005_46581_to_53706.wav,STT_NW,2,147,7.125,wav16k/STT_NW0029_0005_46581_to_53706.wav,བཙན་བྱོལ་བོད་མིའི་འདི་ཉིན་སློབ་གྲྭ་ཁག་གི་སློབ་ཕྲུག་ཚོ་ལ་འགོ་ཁྲིད་ནུས་པ་སྐྱེད་སྲིང་གནང་ཕྱོགས་དང་འབྲེལ་བའི་ཟབ་སྦྱོང་ཐེངས་བཞི་པ་དེ་མཇུག་སྒྲིལ་འདུག
STT_NW0029_0006_53706_to_61076,ད་ག་ནང་བཞིན་ནང་ཆོས་ངོ་སྤྲོད་ཀི་ལས་རིམ་ནང་དུ་བདག་ཡོད་པར་ལྟ་བའི་ལྟ་བ་ཞེས་བའི་གོ་དོན་གང་ཡིན་ངོ་སྤྲོད་གནང་བ་ཞིག་གཟིགས་འབུལ་ཞུ་རྒྱུ་ཡོད་པས།  ,da ga nang bzhin nang chos ngo sprod ki las rim nang du bdag yod par lta ba'i lta ba zhes ba'i go don gang yin ngo sprod gnang ba zhig gzigs 'bul zhu rgyu yod pas/__,https://d38pmlk0v88drf.cloudfront.net/wav16k/STT_NW0029_0006_53706_to_61076.wav,STT_NW,2,136,7.37,wav16k/STT_NW0029_0006_53706_to_61076.wav,ད་ག་ནང་བཞིན་ནང་ཆོས་ངོ་སྤྲོད་ཀི་ལས་རིམ་ནང་དུ་བདག་ཡོད་པར་ལྟ་བའི་ལྟ་བ་ཞེས་པའི་གོ་དོན་གང་ཡིན་ངོ་སྤྲོད་གནང་བ་ཞིག་གཟིགས་འབུལ་ཞུ་རྒྱུ་ཡོད་པས།
STT_NW0029_0007_61076_to_62231,གསར་འགྱུར་ལས་རིམ་མུ་མཐུད་ནས་ ,gsar 'gyur las rim mu mthud nas _,https://d38pmlk0v88drf.cloudfront.net/wav16k/STT_NW0029_0007_61076_to_62231.wav,STT_NW,2,29,1.155,wav16k/STT_NW0029_0007_61076_to_62231.wav,གསར་འགྱུར་ལས་རིམ་མུ་མཐུད་ནསས།་
STT_NW0029_0008_62231_to_71325,གཟིགས་རོགས་གནང་། ལོ་ལྔའི་བཙོན་འཇུག་དུས་ཡུན་རྫོགས་ནས་ཉེ་ལམ་གློད་གྲོལ་བྱུང་བའི་གྲགས་ཙན་ཆབ་སྲིད་བཙོན་ཟུར་འཇིགས་མེད་རྒྱ་མཚོ་འམ།  ,gzigs rogs gnang /_lo lnga'i btson 'jug dus yun rdzogs nas nye lam glod grol byung ba'i grags tsan chab srid btson zur 'jigs med rgya mtsho 'am/__,https://d38pmlk0v88drf.cloudfront.net/wav16k/STT_NW0029_0008_62231_to_71325.wav,STT_NW,2,125,9.094,wav16k/STT_NW0029_0008_62231_to_71325.wav,གཟིགས་རོགས་གནང་། ལོ་ལྔའི་བཙོན་འཇུག་དུས་ཡུན་རྫོགས་ནས་ཉེ་ལམ་བློད་གྲོལ་བྱུང་བའི་གྲངས་ཞེན་ཆབ་སྲིད་བཙོན་ཟུ་འཇིགས་མེད་རྒྱ་མཚོའམ་
STT_NW0029_0009_71325_to_79844,ཡོངས་གྲགས་སུ་འཇིགས་མེད་མགོ་རིལ་ལགས་ལ་ད་ཞག་ནད་གཞི་སྣ་མང་ཞིག་ཕོགས་ནས། ཀན་སུའུ་ཁུལ་གི་ཀན་ལྷོ་བོད་རིགས་རང་སྐྱོང་ཁུལ་སང་ཆུ་རྫོང་གི་སྨན་ཁང་ཞིག་ཏུ་ཡོད་པ་རེད་འདུག།  ,yongs grags su 'jigs med mgo ril lags la da zhag nad gzhi sna mang zhig phogs nas/_kan su'u khul gi kan lho bod rigs rang skyong khul sang chu rdzong gi sman khang zhig tu yod pa red 'dug/__,https://d38pmlk0v88drf.cloudfront.net/wav16k/STT_NW0029_0009_71325_to_79844.wav,STT_NW,2,157,8.519,wav16k/STT_NW0029_0009_71325_to_79844.wav,ཡོངས་གྲགས་སུ་འཇིགས་མེད་འགོ་རིས་ལགས་ལ་ད་ཆ་ནད་གཞི་སྣ་མ་ཞིག་ཕོག་ནས་ཀན་སུ་ཁུལ་ཀན་ལྷོ་བོད་རིགས་རང་སྐྱོང་ཁུལ་གསང་ཆུ་རྫོང་གི་སྨན་ཁང་ཞིག་ཏུ་ཡོད་པ་རེད་འདུག
STT_NW0029_0010_79844_to_85054,དྷ་རམ་ལ་ས་ཡོད་པའི་བོད་ཀི་འགྲོ་བ་མིའི་ཐོབ་ཐང་དང་། དམངས་གཙོ་འཕེལ་རྒྱས་ལྟེ་གནས་ཁང་གིས་གནས་ཚུལ་སྤེལ་གསལ་ལ།  ,d+ha ram la sa yod pa'i bod ki 'gro ba mi'i thob thang dang /_dmangs gtso 'phel rgyas lte gnas khang gis gnas tshul spel gsal la/__,https://d38pmlk0v88drf.cloudfront.net/wav16k/STT_NW0029_0010_79844_to_85054.wav,STT_NW,2,104,5.21,wav16k/STT_NW0029_0010_79844_to_85054.wav,དྷ་རམ་ས་ལར་ཡོད་པའི་བོད་ཀི་འགྲོ་བ་མིའི་ཐོབ་ཐང་དང་ མང་གཙོ་འཕེལ་རྒྱས་བལྟི་གནས་ཁང་གི་གནས་ཚུལ་སྤེལ་སལ་ལ་
STT_NW0029_0011_85054_to_93378,ཟླ་བ་སྔོན་མའི་ཚེས་པ་བཅུ་གཅིག་ཉིན། འཇིགས་མེད་ལགས་ཀན་སུའུ་ཞིང་ཆེན་ཀན་ལྷོ་ཁུལ་གི་ལན་ཀྲུའུ་ཞེས་བའི་གྲོང་ཁྱེར་གི་སྨན་ཁང་དུ་བརྟག་དཔྱད་ཆེད་དུ་ཕྱིན་ཡོད་པ་དང་།  ,zla ba sngon ma'i tshes pa bcu gcig nyin/_'jigs med lags kan su'u zhing chen kan lho khul gi lan kru'u zhes ba'i grong khyer gi sman khang du brtag dpyad ched du phyin yod pa dang /__,https://d38pmlk0v88drf.cloudfront.net/wav16k/STT_NW0029_0011_85054_to_93378.wav,STT_NW,2,152,8.324,wav16k/STT_NW0029_0011_85054_to_93378.wav,ཟླ་བ་སྔོན་མའི་ཚེས་པ་བཅུ་གཅིག་ཉིན་འཇིགས་མེད་རྒྱ་མཚོ་ལགས་ཀན་སུ་ཞིང་ཆེན་ཀན་ལོ་ཁུལ་གི་ལན་འཕྲོ་ཞེས་པའི་གྲོང་ཁྱེར་གི་སྨན་ཁང་དུ་བརྟག་དཔྱད་བྱེད་དུ་ཕྱིན་ཡོད་པ་དང་།
STT_NW0029_0012_93378_to_100769,བརྟག་དཔྱད་ཁང་གིས་ཁོང་ལ་གཅིན་སྙི་དང་། མཆིན་པའི་ན་ཚ། ཁྲག་ཤེད་མཐོ་བ། མིག་ནད་བཅས་ན་ཚ་ཁག་ཅིག་ངོས་འཛིན་བྱས་ཡོད་པ་རེད་འདུག།  ,brtag dpyad khang gis khong la gcin snyi dang /_mchin pa'i na tsha/_khrag shed mtho ba/_mig nad bcas na tsha khag cig ngos 'dzin byas yod pa red 'dug/__,https://d38pmlk0v88drf.cloudfront.net/wav16k/STT_NW0029_0012_93378_to_100769.wav,STT_NW,2,118,7.391,wav16k/STT_NW0029_0012_93378_to_100769.wav,བརྟག་དཔྱད་ཁང་གིས་ཁོང་ལ་ྤཅི་ཉིས་དང་མཆིན་པའི་ན་ཚ། ཁྲག་ཤེད་མཐོ་བ། དམིགས་གནད་བཅས་ན་ཚ་ཁག་གཅིག་ངོས་འཛིན་བྱས་ཡོད་པ་རེད་འདུག
STT_NW0029_0013_100769_to_110454,ད་སྐབས་ཁོང་བླ་བྲང་སང་ཆུ་རྫོང་གི་མི་དམངས་སྨན་ཁང་གིས་ན་ཚ་དེ་དག་ཚབ་ཆེན་ཡིན་པས་ངེས་པར་དུ་སྨན་ཁང་ནང་བསྡད་དགོས་བའི་སྐོར་བཤད་པ་ལྟར། ད་ཆར་རྫོང་སྨན་ཁང་ནང་དུ་ཡོད་པ་རེད་འདུག།  ,da skabs khong bla brang sang chu rdzong gi mi dmangs sman khang gis na tsha de dag tshab chen yin pas nges par du sman khang nang bsdad dgos ba'i skor bshad pa ltar/_da char rdzong sman khang nang du yod pa red 'dug/__,https://d38pmlk0v88drf.cloudfront.net/wav16k/STT_NW0029_0013_100769_to_110454.wav,STT_NW,2,165,9.685,wav16k/STT_NW0029_0013_100769_to_110454.wav,དེང་སྐབས་ཁོང་བླ་བྲང་གསང་ཆུ་རྫོང་གི་མི་མང་སྨན་ཁང་གིས་ན་ཚ་དེ་དག་ཚབ་ཆེན་ཡིན་པས་ ངེས་པར་དུ་སྨན་ཁང་ནང་བསྡད་དགོས་སྐོར་བཤད་པ་ལྟར། ད་ཆ་རྫོང་སྨན་ཁང་ནང་དུ་ཡོད་པ་རེད་འདུག
STT_NW0029_0014_110454_to_118497,འདི་ལོའི་སྤྱི་ཟླ་བཅུ་བའི་ནང་ཁོང་བཙོན་ཁང་ནས་གློད་བྲོལ་བྱུང་བ་ནས་རྒྱ་ནག་གཞུང་གིས་ཁོང་བླ་བྲང་དགོན་པའི་ཆོས་རར་སླར་ཡང་ཞུགས་མི་ཆོག་པའི་བཙན་བཀའ་བཏང་བ་དང་།  ,'di lo'i spyi zla bcu ba'i nang khong btson khang nas glod brol byung ba nas rgya nag gzhung gis khong bla brang dgon pa'i chos rar slar yang zhugs mi chog pa'i btsan bka' btang ba dang /__,https://d38pmlk0v88drf.cloudfront.net/wav16k/STT_NW0029_0014_110454_to_118497.wav,STT_NW,2,149,8.043,wav16k/STT_NW0029_0014_110454_to_118497.wav,འདི་ལོ་སྤྱི་ཟླ་བཅུ་པའི་ནང་ཁོང་བཙོན་ཁང་ནས་གློད་གྲོལ་བྱུང་བ་ནས་བཟུང་། རྒྱ་ནག་གཞུང་གིས་ཁོང་བླ་བྲངས་དགོན་པའི་ཆོས་རྭར་སླར་ཡང་བཞུགས་མི་ཆོག་པའི་བཙན་བཀའ་བཏང་བ་དང་།
STT_NW0029_0015_118497_to_124018,ས་གནས་ཀི་སྤྱི་བདེ་མི་སྣས་ཁོང་གི་འགྲོ་སྤྱོད་ལ་དཀག་སྡོམ་གིས་ལྟ་སྲུང་ནན་པོ་བྱེད་བཞིན་ཡོད་པ་མ་ཟད།  ,sa gnas ki spyi bde mi snas khong gi 'gro spyod la dkag sdom gis lta srung nan po byed bzhin yod pa ma zad/__,https://d38pmlk0v88drf.cloudfront.net/wav16k/STT_NW0029_0015_118497_to_124018.wav,STT_NW,2,95,5.521,wav16k/STT_NW0029_0015_118497_to_124018.wav,ས་གནས་ཀི་སྤྱི་བདེ་མི་སྣས་ཁོང་གིས་འགྲོ་སྐྱོད་ལ་བཀག་སྡོམ་ཀིས།་ལྟ་སྲུང་ནད་མོ་བྱེད་བཞིན་ཡོད་པ་མ་ཟད།
STT_NW0029_0016_124018_to_128638,བཙོན་ཁང་གི་འབྲེལ་ཡོད་ལས་བྱེད་ནས་ཀྱང་ཁོང་གི་ཡུལ་མིའི་ཐོབ་ཐང་ལག་འཁྱེར་དང་། གློག་ཀླད།  ,btson khang gi 'brel yod las byed nas kyang khong gi yul mi'i thob thang lag 'khyer dang /_glog klad/__,https://d38pmlk0v88drf.cloudfront.net/wav16k/STT_NW0029_0016_124018_to_128638.wav,STT_NW,2,84,4.62,wav16k/STT_NW0029_0016_124018_to_128638.wav,བཙོན་ཁང་གི་འབྲེལ་ཡོད་ལས་བྱེད་ནས་ཀྱང་ཁོང་གིས་ཡུལ་མིའི་ཐོབ་ཐང་ལག་འཁྱེར་དང་། གློག་ཀླད་
STT_NW0029_0017_128638_to_131538,ཡིག་ཆ་དང་དངུལ་ཁུག་སོགས་ཕྱིར་སློག་བྱས་མེད་པའི་ཁར་ ,yig cha dang dngul khug sogs phyir slog byas med pa'i khar _,https://d38pmlk0v88drf.cloudfront.net/wav16k/STT_NW0029_0017_128638_to_131538.wav,STT_NW,2,49,2.9,wav16k/STT_NW0029_0017_128638_to_131538.wav,ཡིག་ཆ་དང་དངུལ་ཁུག་སོགས་ཕྱིར་ལོག་བྱས་མེད་པའི་ཁར།
STT_NW0029_0018_131538_to_137418,ས་གནས་སྲིད་གཞུང་གིས་བཙན་ཤེད་ཀིས་སྒོ་ནས། གཞུང་གི་སྨན་ཁང་དུ་གཏན་སྡོད་ཆོག་པའི་ཡིག་ཆ་བཟོ་རུ་བཅུག་པ་སོགས་བྱས་ཏེ།  ,sa gnas srid gzhung gis btsan shed kis sgo nas/_gzhung gi sman khang du gtan sdod chog pa'i yig cha bzo ru bcug pa sogs byas te/__,https://d38pmlk0v88drf.cloudfront.net/wav16k/STT_NW0029_0018_131538_to_137418.wav,STT_NW,2,109,5.88,wav16k/STT_NW0029_0018_131538_to_137418.wav,ས་གནས་སྲིད་གཞུང་གིས་བཙན་ཤེད་ཀི་སྒོ་ནས་གཞུང་གི་སྨན་ཁང་དུ་བསྟན་ཐུག་ཆོག་པའི་ཡིག་ཆ་བཟོ་རུ་བཅུག་པ་སོགས་བྱས་ཏེ།
STT_NW0029_0019_137418_to_142344,ད་ཆ་ཁོང་སྒེར་གི་སྨན་ཁང་ཞིག་ཏུ་གཏན་སྡོད་བྱེད་རྒྱུར་དཀའ་ངལ་འཕྲད་བཞིན་ཡོད་པ་རེད་འདུག།  ,da cha khong sger gi sman khang zhig tu gtan sdod byed rgyur dka' ngal 'phrad bzhin yod pa red 'dug/__,https://d38pmlk0v88drf.cloudfront.net/wav16k/STT_NW0029_0019_137418_to_142344.wav,STT_NW,2,84,4.926,wav16k/STT_NW0029_0019_137418_to_142344.wav,ད་ཆ་ཁོང་སྒེར་གི་སྨན་ཁང་ཞིག་ཏུ་གཏན་གཏུག་བྱེད་རྒྱུར་དཀའ་ངལ་འཕྲད་བཞིན་ཡོད་པ་རེད་འདུག
STT_AB00681_0011_367022_to_371190,དྲུག་བཅུ་རེ་ལྔ། ཡ་རབས་ཀྱི་སྤྱོད་པ་དང་། རང་ཉིད་ཀྱི་བདེ་སྐྱིད།  ,drug bcu re lnga/_ya rabs kyi spyod pa dang /_rang nyid kyi bde skyid/__,https://d38pmlk0v88drf.cloudfront.net/wav16k/STT_AB00681_0011_367022_to_371190.wav,STT_AB,2,62,4.168,wav16k/STT_AB00681_0011_367022_to_371190.wav,དྲུག་ཅུ་རེ་ལྔ། ཡ་རབས་ཀྱི་སྤྱོད་པ་དང་། རང་ཉིད་ཀྱི་བདེ་སྐྱིད།
STT_NW0029_0020_142344_to_152343,ལྟེ་གནས་ཁང་གིས་རྒྱ་ནག་གཞུང་གིས་ཁྲིམས་སྒྲིག་གང་གི་ནང་དུ་ཡང་རྒྱལ་ཁབ་ཀི་བདེ་འཇགས་ལ་གནོད་སྐྱོན་བཟོ་བ་ཞེས་པའི་ཉེན་འཛུགས་ཐེབས་མཁན་ཚོ་ཡིས་ཡུལ་མིའི་ཐོབ་ཐང་ལག་འཁྱེར་འཕྲོག་དགོས་བའི་སྐད་ཆ་མེད་ཅེས་དང་།  ,lte gnas khang gis rgya nag gzhung gis khrims sgrig gang gi nang du yang rgyal khab ki bde 'jags la gnod skyon bzo ba zhes pa'i nyen 'dzugs thebs mkhan tsho yis yul mi'i thob thang lag 'khyer 'phrog dgos ba'i skad cha med ces dang /__,https://d38pmlk0v88drf.cloudfront.net/wav16k/STT_NW0029_0020_142344_to_152343.wav,STT_NW,2,191,9.999,wav16k/STT_NW0029_0020_142344_to_152343.wav,བལྟི་གནས་ཁང་གིས་རྒྱ་ནག་གཞུང་གི་ཁྲིམས་སགྲིག་གང་གི་ནང་དུ་ཡང་རྒྱལ་ཁབ་ཀི་བདེ་འཇགས་ལ་གནོད་སྐྱོན་བཟོས་པ་ཞེས་པའི་ཉེས་འཛུགས་ཐེབས་མཁན་ཚོས་ཡིས་ཡུལ་མིའི་ཐོབ་ཐང་ལག་འཁྱེར་འཕྲོག་དགོས་པའི་སྐད་ཆ་མེད་ཅེས་དང་།
STT_NW0029_0021_152343_to_158724,ཁོང་ལ་ན་ཚ་ཚབ་ཆེན་ཕོག་པའི་གནས་སྟངས་འོག་ཡུལ་མིའི་ཐོབ་ཐང་ལག་འཁྱེར་མི་སྤྲད་པ་དང་། གཞུང་གི་སྨན་ཁང་ནང་དུ་བཞག་དགོས་དོན་ནི།  ,khong la na tsha tshab chen phog pa'i gnas stangs 'og yul mi'i thob thang lag 'khyer mi sprad pa dang /_gzhung gi sman khang nang du bzhag dgos don ni/__,https://d38pmlk0v88drf.cloudfront.net/wav16k/STT_NW0029_0021_152343_to_158724.wav,STT_NW,2,117,6.381,wav16k/STT_NW0029_0021_152343_to_158724.wav,ཁོང་ལ་ན་ཚ་ཚབས་ཆེན་ཕོག་པའི་གནས་སྟངས་འོག་ཡུལ་མིའི་ཐོབ་ཐང་ལག་འཁྱེར་མི་སྤྲོད་པ་དང་། གཞུང་གི་སྨན་ཁང་ནང་དུ་བཞག་དགོས་དོན་ནི།
STT_NW0029_0022_158724_to_163963,སྲིད་གཞུང་གིས་དགེ་འདུན་པ་ཁོང་ལ་མུ་མཐུད་ལྟ་རྟོག་ནན་མོ་བྱེད་རྒྱུའི་ཆེད་དུ་ཡིན་པ་འགྲེལ་བརྗོད་གནང་བ་དང་།  ,srid gzhung gis dge 'dun pa khong la mu mthud lta rtog nan mo byed rgyu'i ched du yin pa 'grel brjod gnang ba dang /__,https://d38pmlk0v88drf.cloudfront.net/wav16k/STT_NW0029_0022_158724_to_163963.wav,STT_NW,2,102,5.239,wav16k/STT_NW0029_0022_158724_to_163963.wav,སྲིད་གཞུང་གི་དགེ་འདུན་པ་ཁོང་ལ་མུ་མཐུད་ལྟ་རྟོག་ནད་མོ་བྱེད་རྒྱུའི་ཆེད་དུ་ཡིན་པ་འགྲེལ་བརྗོད་གནང་བ་དང་།
STT_MV0483_0013_187025_to_189136,མནའ་འབྲེལ་བྱེད་ཀྱི་ཡིན་ཟེ།  ,mna' 'brel byed kyi yin ze/__,https://d38pmlk0v88drf.cloudfront.net/wav16k/STT_MV0483_0013_187025_to_189136.wav,STT_MV,2,28,2.111,wav16k/STT_MV0483_0013_187025_to_189136.wav,མནའ་འབྲེལ་བྱེད་ཀི་ཡིན་ཟེ།
