file_name,uni,wylie,url,dept,grade,char_len,audio_len,path,inf
STT_NW0033_0155_978628_to_980016,བྱས་ངས་དེ་ཞུས་ཡ་ཡིན།  ,byas ngas de zhus ya yin/__,https://d38pmlk0v88drf.cloudfront.net/wav16k/STT_NW0033_0155_978628_to_980016.wav,STT_NW,2,22,1.388,wav16k/STT_NW0033_0155_978628_to_980016.wav,བྱས་ངས་དི་ཞུ་ཡ་ཡིན།
STT_NW0033_0156_980016_to_990015,དེ་རིང་གི་གསར་འགྱུར་གི་ལས་རིམ་འདི་ནས་མཚམས་བཞག་གི་ཡིན། རྣམ་པ་ཚོས་བོད་དོན་གསར་འགྱུར་རྒྱས་པ་ཁག་གཤམ་འགོད་དྲྭ་ཚིགས་དེ་ཚོའི་ཐོག་ནས་གཟིགས་རྒྱུ་ཡོད། དེ་ནས་གཤམ་ལ་དྷ་རམ་ས་ལའི་གནམ་གཤིས་སྔོན་བརྡ་དང་། སྨན་རྩིས་ཁང་གི་ལོ་ཐོ་གཟིགས་རོགས་གནང་།  ,de ring gi gsar 'gyur gi las rim 'di nas mtshams bzhag gi yin/_rnam pa tshos bod don gsar 'gyur rgyas pa khag gsham 'god drwa tshigs de tsho'i thog nas gzigs rgyu yod/_de nas gsham la d+ha ram sa la'i gnam gshis sngon brda dang /_sman rtsis khang gi lo tho gzigs rogs gnang /__,https://d38pmlk0v88drf.cloudfront.net/wav16k/STT_NW0033_0156_980016_to_990015.wav,STT_NW,2,227,9.999,wav16k/STT_NW0033_0156_980016_to_990015.wav,དེ་རིང་གི་གསར་འགྱུར་ལས་རིམ་འདི་ནས་མཚམས་བཞག་གི་ཡིན། རྣམ་པ་ཚོས་དཔེ་དོན་གསར་འགྱུར་རྒྱས་པ་ཁག་གཤམ་འགོད་དྲྭ་ཚིགས་དེ་ཚོའི་ཐོག་ནས་གཟིགས་རྒྱུ་ཡོད། དེ་ནས་གཤམ་ལ་དྷ་རམ་ས་ལའི་གྣམ་གཤིས་སྔོན་བསྡུ་དང་སྨན་རྩིས་ཁང་གི་ལོ་ཐོ་གཟིགས་རོགས་གནང་།
STT_NW0033_0157_990015_to_996099,བོད་ཟླ་བདུན་པའི་ཚེས་ལྔ་དང་། ཕྱི་ཟླ་བརྒྱད་པའི་ཚེས་བཅུ་དགུ། རེས་གཟའ་ལྷག་པ། རེས་འགྲོགས་ཟླ་སྐར། མེ་བཞི། འབྱུང་འཕྲོད་ཆུ་རླུང་།  ,bod zla bdun pa'i tshes lnga dang /_phyi zla brgyad pa'i tshes bcu dgu/_res gza' lhag pa/_res 'grogs zla skar/_me bzhi/_'byung 'phrod chu rlung /__,https://d38pmlk0v88drf.cloudfront.net/wav16k/STT_NW0033_0157_990015_to_996099.wav,STT_NW,2,123,6.084,wav16k/STT_NW0033_0157_990015_to_996099.wav,བོད་ཟླ་བདུན་པའི་ཚེས་ལྔ་དང་། ཕྱི་ཟླ་བརྒྱད་པའི་ཚེས་བཅུ་དགུ། རེས་གཟའ་ལྷག་པ། རི་འགྲོགས་ཟླ་སྐར་མེ་ཤི་འབྱུང་འཕྲོད་ཆུ་ཀླུང་།
STT_NW0033_0158_996099_to_1005763,དེའི་ཉིན་འཕྲོད་སྦྱོར་ཞན་པས། རྒྱུན་ལྡན་གི་ཕྱག་ལས་གནང་བསྡད་ཡ་མ་གཏོགས། གཞན་ལས་གཞི་གསར་བའི་རིགས་འགོ་འཛུགས་གནང་ངན་པ་ཡིིན། ལྷག་པར་དུ་གཟའི་གནམ་རྒྱ་ཁེལ་བས། ཆང་སའི་རྟེན་འབྲེལ་བྱེད་རྒྱུ་ངན་པ་དང་།  ,de'i nyin 'phrod sbyor zhan pas/_rgyun ldan gi phyag las gnang bsdad ya ma gtogs/_gzhan las gzhi gsar ba'i rigs 'go 'dzugs gnang ngan pa yi+in/_lhag par du gza'i gnam rgya khel bas/_chang sa'i rten 'brel byed rgyu ngan pa dang /__,https://d38pmlk0v88drf.cloudfront.net/wav16k/STT_NW0033_0158_996099_to_1005763.wav,STT_NW,2,187,9.664,wav16k/STT_NW0033_0158_996099_to_1005763.wav,དེ་ཉིན་འཕྲོས་འྦྱོར་བཞིན་པའི་རྒྱུན་ལྡས་ཀི་ཕྱག་ལས་གནང་བསྡད་ཡ་མ་གཏོགས། གཞན་ལས་གཞི་གསར་པའི་རིགས་འགོ་བཙུགས་ན་ངན་པ་ཡིན། ལྷག་པར་དུ་ཟའི་རྣམ་རྒྱིས་ཁེལ་བའི་ཆང་སའི་རྟེན་འབྲེལ་བྱེད་རྒྱུར་ངན་པ་དང་།
STT_NW0033_0159_1005763_to_1015056,གཞན་ཡང་གཉེན་གྱི་གནམ་སྒོ། བུ་མོ་སོགས་མག་པ་སོགས་སློང་བ། གཉེན་སྒྲིག་བྱེད་པ་དང་། བུ་དང་བུ་མོའི་ཆེད་དུ་གཉེན་སྒྲིག་གི་ཐོག་མར་སྐད་ཆ་བཤད་པ། གཉེན་ཚན་ལ་ཞལ་ལག་གཏང་བ།  ,gzhan yang gnyen gyi gnam sgo/_bu mo sogs mag pa sogs slong ba/_gnyen sgrig byed pa dang /_bu dang bu mo'i ched du gnyen sgrig gi thog mar skad cha bshad pa/_gnyen tshan la zhal lag gtang ba/__,https://d38pmlk0v88drf.cloudfront.net/wav16k/STT_NW0033_0159_1005763_to_1015056.wav,STT_NW,2,156,9.293,wav16k/STT_NW0033_0159_1005763_to_1015056.wav,གཞན་ཡང་གཉེན་གི་རྣམ་བྒོས། བུ་དང་བུ་མོ། མག་པ་སོགས་སློང་བ། གཉེན་སྒྲིག་བྱེད་པ་དང་། བུ་དང་བུ་མོའི་ཆེད་དུ་གཉེན་སྒྲིག་གི་ཐོག་མར་སྐད་ཆ་བཤད་པ། གཉེན་རྫས་ལ་ཞལ་ལག་གཏོང་བ།
STT_NW0033_0160_1015056_to_1018271,ཐུགས་སྤྲོ་སོགས་སྟོན་མོ་གནང་མི་རུང་བ་ཡིན་པས། དགོངས་འཇགས་ཡོང་བར་ཞུ།  ,thugs spro sogs ston mo gnang mi rung ba yin pas/_dgongs 'jags yong bar zhu/__,https://d38pmlk0v88drf.cloudfront.net/wav16k/STT_NW0033_0160_1015056_to_1018271.wav,STT_NW,2,67,3.215,wav16k/STT_NW0033_0160_1015056_to_1018271.wav,ཐུག་སྤྲོ་སོགས་གཏོན་མོ་གནང་མི་རུང་བ་ཡིན་པས། དགོངས་འཇག་ཡོང་བར་ཞུ།
STT_NW0033_0161_1018271_to_1025696,དེའི་ཉིན་བོད་ནང་བྱང་ཁད་ཆར་བ་ཅུང་ཉུང་དུ་འགྲོ། བོད་ཟླ་བདུན་པའི་ཚེས་དྲུག་དང་། ཕྱི་ཟླ་བརྒྱད་པའི་ཚེས་ཉི་ཤུ། ཪེས་གཟའ་ཕུར་བུ།  ,de'i nyin bod nang byang khad char ba cung nyung du 'gro/_bod zla bdun pa'i tshes drug dang /_phyi zla brgyad pa'i tshes nyi shu/_Res gza' phur bu/__,https://d38pmlk0v88drf.cloudfront.net/wav16k/STT_NW0033_0161_1018271_to_1025696.wav,STT_NW,2,120,7.425,wav16k/STT_NW0033_0161_1018271_to_1025696.wav,དེའི་ཉིན་ནས་བོད་ནང་བྱ་སྐད་ཆགས། ཆར་པ་ཅུང་ཉུང་དུ་འགྲོ། བོད་ཟླང་བདུན་པའི་ཚེས་དྲུག་དང་། ཕྱི་ཟླ་བརྒྱད་པའི་ཚེས་ཉི་ཤུ། རེས་གཟའ་ཕུར་བུ་
STT_NW0033_0162_1025696_to_1032098,རེས་འགྲོགས་ཟླ་སྐར། ནག་པ། འབྱུང་འཕྲོད་རླུང་མེ། འཕྲོད་སྦྱོར་བཟང་བས་རི་མགོར་རླུང་རྟའི་དར་ལྕོག་བཙུགས་པ་དང་། རབ་ཏུ་བྱུང་བ། རབ་གནས་བྱེད་པ།  ,res 'grogs zla skar/_nag pa/_'byung 'phrod rlung me/_'phrod sbyor bzang bas ri mgor rlung rta'i dar lcog btsugs pa dang /_rab tu byung ba/_rab gnas byed pa/__,https://d38pmlk0v88drf.cloudfront.net/wav16k/STT_NW0033_0162_1025696_to_1032098.wav,STT_NW,2,134,6.402,wav16k/STT_NW0033_0162_1025696_to_1032098.wav,རི་འགྲོགས་ཟླ་དཀར་ནག་པ། འབྱུང་འགྲོད་རླུང་ཉིན། ཕྲོ་ྦྱོར་བཟང་བའི་རི་མགོ་རླུང་རྟིའ་དར་ལྕོག་བཙུགས་པ་དང་། རབ་ཏུ་བྱུང་བ། རབ་གནས་བྱེད་པ།
STT_NW0033_0163_1032098_to_1036721,སྨན་སྦྱོར་བྱེད་རྒྱུ། ལྷག་པར་དུ་སློབ་པ་སློབ་གཉེར་འགོ་བཙུགས་བྱེད་པ། སྐྱེ་ཤིང་མེ་ཏོག་བཙུགས་པ།  ,sman sbyor byed rgyu/_lhag par du slob pa slob gnyer 'go btsugs byed pa/_skye shing me tog btsugs pa/__,https://d38pmlk0v88drf.cloudfront.net/wav16k/STT_NW0033_0163_1032098_to_1036721.wav,STT_NW,2,92,4.623,wav16k/STT_NW0033_0163_1032098_to_1036721.wav,སྨན་སྦྱོར་བྱེད་རྒྱུ། ལྷག་པར་དུ་གློ་བ་སློབ་གཉེར་འགོ་འཛུགས་བྱེད་པ། སྐྱེས་ཤིང་མེ་ཏོག་བཙུགས་པ།
STT_NW0033_0164_1036721_to_1040821,ཕ་མའི་ཆེད་ལས་དོན་བྱེད་པ། བཀྲ་ཤིས་བའི་ལས་དོན་ཕལ་ཆེ་བ་བཟང་པོ་ཡོད་ན་ཡང་།  ,pha ma'i ched las don byed pa/_bkra shis ba'i las don phal che ba bzang po yod na yang /__,https://d38pmlk0v88drf.cloudfront.net/wav16k/STT_NW0033_0164_1036721_to_1040821.wav,STT_NW,2,71,4.1,wav16k/STT_NW0033_0164_1036721_to_1040821.wav,ཕ་མིའི་ཆས། ལས་དོན་བྱེད་པ། བཀྲ་ཤིས་པའི་ལས་དོན་ཕལ་ཆེ་བར་བཟང་པོ་ཡོད་ན་ཡང་།
STT_NW0033_0165_1040821_to_1048737,ཟླ་བ་དེེར་ཟླ་ནག་ཡིན་པས། ཟླ་ནག་གི་གཏོ་བཅོས་ངེས་པར་དུ་གནང་དགོས། དེའི་ཉིན་མཁར་གྱི་གནམ་སྒོ། ཁང་པ་གསར་རྒྱག་འགོ་འཛུགས་བྱེད་པ་དང་། ཁང་པ་ཉོ་ཚོང་བྱེད་པ།  ,zla ba de+er zla nag yin pas/_zla nag gi gto bcos nges par du gnang dgos/_de'i nyin mkhar gyi gnam sgo/_khang pa gsar rgyag 'go 'dzugs byed pa dang /_khang pa nyo tshong byed pa/__,https://d38pmlk0v88drf.cloudfront.net/wav16k/STT_NW0033_0165_1040821_to_1048737.wav,STT_NW,2,145,7.916,wav16k/STT_NW0033_0165_1040821_to_1048737.wav,ཟླ་བ་འདི་ཟླ་ནག་ཡིན་པས་ཟླ་ནག་གི་གཏོར་བཅོས་ངེས་པར་དུ་གནང་དགོས། འདིའ་ཉིན་མཁར་གི་གནམ་སྒོའ།་ཁང་པ་གས་རྒྱག་འགོ་འཛུགས་བྱས་པ་དང་། ཁང་པ་ཉོ་ཚོང་བྱེད་པ།
STT_NW0033_0166_1048737_to_1049823,ཁང་པ་སྤོ་བ།  ,khang pa spo ba/__,https://d38pmlk0v88drf.cloudfront.net/wav16k/STT_NW0033_0166_1048737_to_1049823.wav,STT_NW,2,13,1.086,wav16k/STT_NW0033_0166_1048737_to_1049823.wav,ཁང་པ་སྤོ་བ།
STT_NW0033_0167_1049823_to_1053407,ཁྱིམ་ཚང་གསར་དུ་བཟུང་བ། ཚོང་ཁང་དང་ཟ་ཁང་སོགས་གསར་དུ་སྒོ་འབྱེད་བྱེད་པ།  ,khyim tshang gsar du bzung ba/_tshong khang dang za khang sogs gsar du sgo 'byed byed pa/__,https://d38pmlk0v88drf.cloudfront.net/wav16k/STT_NW0033_0167_1049823_to_1053407.wav,STT_NW,2,69,3.584,wav16k/STT_NW0033_0167_1049823_to_1053407.wav,ཁྱིམ་ཚང་གསར་དུ་བཟུང་བ། ཚོང་ཁང་དང་ཟ་ཁང་སོགས་གསར་དུ་སྒོ་འབྱེད་བྱེད་པ།
STT_NW0033_0168_1053407_to_1056270,ལས་ཁུངས་དང་ཡིག་ཚང་སོགས་གསར་དུ་སྒོ་འབྱེད་བྱེད་པར་ངན་པ་ཡིན།  ,las khungs dang yig tshang sogs gsar du sgo 'byed byed par ngan pa yin/__,https://d38pmlk0v88drf.cloudfront.net/wav16k/STT_NW0033_0168_1053407_to_1056270.wav,STT_NW,2,59,2.863,wav16k/STT_NW0033_0168_1053407_to_1056270.wav,ལས་ཁུངས་དང་ཡིག་ཚང་སོགས་གསར་དུ་གོ་འབྱེད་བྱེད་པར་ངན་པ་ཡིན།
STT_NW0033_0169_1056270_to_1058085,ཐུགས་རྗེ་ཆེ།  ,thugs rje che/__,https://d38pmlk0v88drf.cloudfront.net/wav16k/STT_NW0033_0169_1056270_to_1058085.wav,STT_NW,2,14,1.815,wav16k/STT_NW0033_0169_1056270_to_1058085.wav,ཐུགས་རྗེ་ཆེ།
STT_NW0034_0000_12950_to_15887,ལྷན་རྒྱས་སྐུ་ཁམས་བཟང་། བོད་ཀི་བརྙན་འཕྲིན་གསར་འགྱུར་ལས་རིམ་འགོ་འཛུགས་ཞུ་གི་ཡིན།  ,lhan rgyas sku khams bzang /_bod ki brnyan 'phrin gsar 'gyur las rim 'go 'dzugs zhu gi yin/__,https://d38pmlk0v88drf.cloudfront.net/wav16k/STT_NW0034_0000_12950_to_15887.wav,STT_NW,2,80,2.937,wav16k/STT_NW0034_0000_12950_to_15887.wav,ལྷན་རྒྱས་སྐུ་ཁམས་བཟང་། བོད་ཀི་བརྙན་འཕྲིན་གསར་འགྱུར་ལས་རིམ་འགོ་འྡུ་ཞུ་གི་ཡིན།
STT_NW0034_0001_15887_to_24460,དེ་རིང་ནི་བོད་རྒྱལ་ལོ་ཉིས་སྟོང་བརྒྱ་དང་བཞི་ཅུ་ཞེ་གཉིས། རབ་གནས་ཤིང་ལུག་ལོའི་བོད་ཟླ་བདུན་པ་གྲོ་བཞིན་ཟླ་བའི་ཚེས་པ་དྲུག་དང་། ཕྱི་ལོ་ཉིས་སྟོང་བཅོ་ལྔ་ཟླ་བ་བརྒྱད་པའི་ཚེས་ཉི་ཤུ། གཟའ་ཕུར་བུ་རེད།  ,de ring ni bod rgyal lo nyis stong brgya dang bzhi cu zhe gnyis/_rab gnas shing lug lo'i bod zla bdun pa gro bzhin zla ba'i tshes pa drug dang /_phyi lo nyis stong bco lnga zla ba brgyad pa'i tshes nyi shu/_gza' phur bu red/__,https://d38pmlk0v88drf.cloudfront.net/wav16k/STT_NW0034_0001_15887_to_24460.wav,STT_NW,2,187,8.573,wav16k/STT_NW0034_0001_15887_to_24460.wav,ད་རིང་ནི་བོད་རྒྱལ་ལོ་ཉིས་སྟོང་བརྒྱ་དང་བཞི་བཅུ་ཞེ་གཉིས་རབ་གནས་ཤིང་ལུས་ལོའི་བོད་ཟླ་བདུན་པ་གྲོ་ཞིང་ཟླ་བའི་ཚེས་པ་དྲུག་དང་། ཕྱི་ལོ་ཉིས་སྟོང་བཅོ་ལྔ། ཟླ་བ་བརྒྱད་པའི་ཚེས་ཉི་ཤུ་གཟའ་ཕུར་བུ་རེད།
STT_NW0034_0002_24460_to_34328,སྙན་སྒྲོན་ཞུ་མཁན་ང་རྣམ་རྒྱལ་ཚེ་དབང་ཡིན། ཉེ་ཆར་ཤེས་རིག་ལས་ཁུངས་ནས་ཉིན་མ་གསུམ་གི་ཕ་མའི་ཚོགས་ཆེན་ཐེངས་དང་པོ་དེ་བཞུགས་སྒར་དྷ་རམ་ས་ལར་སྐོང་འཚོགས་གནང་བ་རེད།  ,snyan sgron zhu mkhan nga rnam rgyal tshe dbang yin/_nye char shes rig las khungs nas nyin ma gsum gi pha ma'i tshogs chen thengs dang po de bzhugs sgar d+ha ram sa lar skong 'tshogs gnang ba red/__,https://d38pmlk0v88drf.cloudfront.net/wav16k/STT_NW0034_0002_24460_to_34328.wav,STT_NW,2,152,9.868,wav16k/STT_NW0034_0002_24460_to_34328.wav,སྙན་སྒྲོན་ཞུ་མཁན་ང་རྣམ་རྒྱལ་ཚོ་དབང་ཡིན། ཉེ་ཆར་ཤེས་རིག་ལས་ཁུངས་ནས་ཉིན་མ་གསུམ་གི་ཕ་མའི་ཚོགས་ཆེན་ཐེངས་དང་པོ་དེ་བཞུགས་སྒར་དྷ་རམ་ས་ལ་སྐོང་ཚོགས་གནང་བ་རེད།
STT_NW0034_0003_34328_to_42122,དམིགས་ཡུལ་གཙོ་བོ་བོད་པའི་ཕྲུ་གུ་ཚོའི་ཤེས་ཡོན་གནས་ཚད་ཡར་རྒྱས་གཏོང་རྒྱུའི་ཆེད་དུ་ཡིན་པ་དང་། བཙན་བྱོལ་བོད་མི་གནས་ཡུལ་ས་གནས་བཞི་ཅུ་ཞེ་གསུམ་གི་ཕ་མའི་འཐུས་མི་ཚོགས་བཅར་གནང་འདུག ,dmigs yul gtso bo bod pa'i phru gu tsho'i shes yon gnas tshad yar rgyas gtong rgyu'i ched du yin pa dang /_btsan byol bod mi gnas yul sa gnas bzhi cu zhe gsum gi pha ma'i 'thus mi tshogs bcar gnang 'dug_,https://d38pmlk0v88drf.cloudfront.net/wav16k/STT_NW0034_0003_34328_to_42122.wav,STT_NW,2,170,7.794,wav16k/STT_NW0034_0003_34328_to_42122.wav,དམིགས་ཡུལ་གཙོ་བོ་བོད་པའི་ཕྲུ་གུ་ཚོས་ཤེས་ཡོན་གནས་ཚད་ཡར་རྒྱས་གཏོང་རྒྱུའི་ཆེད་དུ་ཡིན་པ་དང་། བཙན་བྱོལ་བོད་མིའི་གནས་ཡུལ་ས་གནས་བཞི་བཅུ་ཞེ་གསུམ་གི་ཕ་མའི་འཐུས་མིའི་ཚོགས་བཅར་གནང་འདུག
STT_NW0034_0004_42122_to_48321,དཔལ་ལྡན་སྲིད་སྐྱོང་འབུམ་རམས་པ་བློ་བཟང་སེང་གེ་མཆོག་དང་། ཤེས་རིག་བཀའ་བློན་དངོས་གྲུབ་ཚེ་རིང་རྣམ་གཉིས་ནས་ཚོགས་ཆེན་ཐོག་ལ་གསུང་བཤད་གནང་ཡོད་པ་རེད།  ,dpal ldan srid skyong 'bum rams pa blo bzang seng ge mchog dang /_shes rig bka' blon dngos grub tshe ring rnam gnyis nas tshogs chen thog la gsung bshad gnang yod pa red/__,https://d38pmlk0v88drf.cloudfront.net/wav16k/STT_NW0034_0004_42122_to_48321.wav,STT_NW,2,141,6.199,wav16k/STT_NW0034_0004_42122_to_48321.wav,དཔལ་ལྡན་སྲིད་སྐྱོང་འབུམ་རམས་པ་བློ་བཟང་སེང་གེ་མཆོག་དང་ཤེས་རིག་བཀའ་བློན་དངོས་གྲུབ་ཚེ་རིང་རྣམ་གཉིས་ནས་ཚོགས་ཆེན་ཐོག་ལ་གསུང་བཤད་གནང་ཡོད་པ་རེད།
STT_NW0034_0005_48321_to_57947,ཉིན་མ་གསུམ་གི་རིང་ཕ་མ་ཚོར་བཟང་སྤྱོད་དང་འབྲེལ་ནས་བུ་ཕྲུག་གསོ་སྐྱོང་གནང་ཕྱོགས་དང་། ཤེས་རིག་སློབ་ཡོན་དང་སློབ་འཇུག་སྐོར་དགེ་རྒན་ཕ་མའི་ཚོགས་ཆུང་གི་རྩ་འཛིན་ལམ་སྟོན་ངོ་སྤྲོད་སོགས་གནང་བ་དང་མཉམ་དུ་ ,nyin ma gsum gi ring pha ma tshor bzang spyod dang 'brel nas bu phrug gso skyong gnang phyogs dang /_shes rig slob yon dang slob 'jug skor dge rgan pha ma'i tshogs chung gi rtsa 'dzin lam ston ngo sprod sogs gnang ba dang mnyam du _,https://d38pmlk0v88drf.cloudfront.net/wav16k/STT_NW0034_0005_48321_to_57947.wav,STT_NW,2,189,9.626,wav16k/STT_NW0034_0005_48321_to_57947.wav,ཉིན་མ་གསུམ་གི་རིང་ཕ་མ་ཚོར་བཟང་སྤྱོད་དང་འབྲེལ་ནས་བུ་ཕྲུག་གསོ་སྐྱོང་གནང་ཕྱོགས་དང་། ཤེས་རིག་སློབ་ཡོན་དང་སློབ་འཇུག་སྐོར་ དགེ་རྒན་ཕ་མའི་ཚོགས་ཆུང་གི་རྩ་འཛིན་ལམ་སྟོན་ངོ་སྤྲོད་སོགས་གནང་བ་དང་མཉམ་དུ་
STT_NW0034_0006_57947_to_65461,ཕ་མ་ཚོ་ཚོགས་ཆུང་འཆར་འགོད་གནང་ནས་ཕ་མའི་ངོས་ནས་སློབ་ཕྲུག་གི་ཤེས་ཡོན་ཡར་རྒྱས་ལ་སྨན་པའི་ལས་དོན་གནང་ཕྱོགས་སྐོར་གོ་བསྡུར་སྦྱངས་བཤད་གནང་ཡོད་པ་རེད།  ,pha ma tsho tshogs chung 'char 'god gnang nas pha ma'i ngos nas slob phrug gi shes yon yar rgyas la sman pa'i las don gnang phyogs skor go bsdur sbyangs bshad gnang yod pa red/__,https://d38pmlk0v88drf.cloudfront.net/wav16k/STT_NW0034_0006_57947_to_65461.wav,STT_NW,2,141,7.514,wav16k/STT_NW0034_0006_57947_to_65461.wav,ཕ་མ་ཚོ་ཚོགས་ཆུང་ཆར་བཀོད་གནང་ནས་ཕ་མའི་ངོས་ནས་སློབ་ཕྲུག་གི་ཤེས་ཡོན་ཡར་རྒྱས་ལ་སྨན་པའི་ལས་དོན་གནང་ཕྱོགས་སྐོར་གོ་བསྡུར་སྦྱང་བཤས་གནང་ཡོད་པ་རེད།
STT_NW0034_0007_65461_to_74923,དེ་རིང་ང་ཚོའི་ཤེས་རིག་ལས་ཁུངས་ཀི་སྲོལ་རྒྱུན་ཤེས་ཡོན་ཚན་པའི་འགན་འཛིན་ཚེ་རིང་བསམ་གྲུབ་ལགས་ལ་ཚོགས་ཆེན་དེའི་སྤྱི་ཡོངས་གནས་སྟངས་དང་། མཐའ་མའི་ཐག་གཅོད་དང་གྲུབ་འབྲས་སོགས་ཀི་གནད་དོན་ཐོག་ལ་ཡ་བཅར་འདྲི་ཞུ་གི་ཡིན།  ,de ring nga tsho'i shes rig las khungs ki srol rgyun shes yon tshan pa'i 'gan 'dzin tshe ring bsam grub lags la tshogs chen de'i spyi yongs gnas stangs dang /_mtha' ma'i thag gcod dang grub 'bras sogs ki gnad don thog la ya bcar 'dri zhu gi yin/__,https://d38pmlk0v88drf.cloudfront.net/wav16k/STT_NW0034_0007_65461_to_74923.wav,STT_NW,2,202,9.462,wav16k/STT_NW0034_0007_65461_to_74923.wav,དེ་རིང་ང་ཚོའི་ཤེས་རིག་ལས་ཁུངས་ཀི་སྲོལ་རྒྱུན་ཤེས་ཡོན་ཚན་པའི་འགན་འཛིན་ཚེ་རིང་བསམ་སགྲུབ་ལགས་ལ་ ཚོགས་ཆེན་འདིའི་སྤྱི་ཡོངས་གནས་སྟངས་དང་མཐའ་མའི་ཐག་གཅོད་དང་གྲུབ་འབྲས་སོགས་ཀི་གནད་དོན་ཐོག་ལ་ཡ་བཅར་འདྲི་ཞུ་གི་ཡིན།
STT_AB00647_0067_451600_to_454604,སྔར་གྱི་ལས་ཚན་ཁོངས་སུ་མ་ཚུད་པ་མང་པོ་གསར་འཛུགས་དང་།  ,sngar gyi las tshan khongs su ma tshud pa mang po gsar 'dzugs dang /__,https://d38pmlk0v88drf.cloudfront.net/wav16k/STT_AB00647_0067_451600_to_454604.wav,STT_AB,2,52,3.004,wav16k/STT_AB00647_0067_451600_to_454604.wav,སྔར་གྱི་ལས་ཚན་ཁོངས་སུ་མ་ཚུད་པ་མང་པོ་གསར་འཛུགས་དང་།
STT_NW0034_0008_74923_to_83429,ད་ལྟ་ཚེ་རིང་བསམ་གྲུབ་ལགས་ལ་ཡ་འདི་གཅིག་བཀའ་འདྲི་ཞུ་ཡ་ཡིན། ད་ད་ལན་ཤེས་རིག་ལས་ཁུངས་ངོས་ནས་ད་ལྟ་ཕ་མའི་ཚོ་གི་ཚོགས་ཆེན་འདུག་སེ་སྐོང་འཚོགས་གནང་རེད། ད་ཤེས་རིག་ལས་ཁུངས་ངོས་ནས་ད་ཕ་མའི་ཚོགས་ཆུང་ ,da lta tshe ring bsam grub lags la ya 'di gcig bka' 'dri zhu ya yin/_da da lan shes rig las khungs ngos nas da lta pha ma'i tsho gi tshogs chen 'dug se skong 'tshogs gnang red/_da shes rig las khungs ngos nas da pha ma'i tshogs chung _,https://d38pmlk0v88drf.cloudfront.net/wav16k/STT_NW0034_0008_74923_to_83429.wav,STT_NW,2,184,8.506,wav16k/STT_NW0034_0008_74923_to_83429.wav,ད་ད་ལྟ་ཚེ་བཚམས་རུག་ལགས་ལ་ཡ་འདེ་གཅིག་བཀའ་འདྲི་ཞུ་ཡ་ཡིན། ད་ད་ལན་ཤེས་རིག་ལས་ཁུངས་ངོས་ནས་ད་ལྟ་ཕ་མའི་ཚོ་གི་ད་ཚོགས་ཆེན་འདུག་སེ་སྐོང་ཚོར་གནང་རེད། ད་ཤེས་རིག་ལས་ཁུངས་ངོས་ནས་ད་ཕ་མའི་ཚོགས་ཆུང་
