file_name,uni,wylie,url,dept,grade,char_len,audio_len,path,inf
STT_NW0030_0055_349067_to_356761,དཔལ་ལྡན་ཚོགས་གཞོན་མཆོག་གིས་བོད་པ་དང་ཐའེ་ཝན། ཧོང་ཀོང་། ཡུ་གུར། ནང་སོག་བཅས་ཕན་ཚུན་མཛའ་འབྲེལ་གོང་མཐོར་བཏང་སྟེ། མཉམ་རུབ་ཀི་ཐོག་ནས་རྒྱ་ནག་དམར་ཤོག་ལ་ ,dpal ldan tshogs gzhon mchog gis bod pa dang tha'e wan/_hong kong /_yu gur/_nang sog bcas phan tshun mdza' 'brel gong mthor btang ste/_mnyam rub ki thog nas rgya nag dmar shog la _,https://d38pmlk0v88drf.cloudfront.net/wav16k/STT_NW0030_0055_349067_to_356761.wav,STT_NW,2,144,7.694,wav16k/STT_NW0030_0055_349067_to_356761.wav,དཔལ་ལྡན་ཚོགས་ཆེན་མཆོག་གིས་བོད་པ་དང་ཐའེ་ཝན། ཧོང་ཀོང་། གཡུ་འགུར། ནང་སྲོག་བཅས་ཕན་ཚུན་མཛའ་འབྲེལ་གོང་གཐོར་བཏང་སྟེ། མཉམ་རུབ་ཀི་ཐོག་ནས་རྒྱ་ནག་དམར་ཤུགས་ལ་
STT_NW0030_0056_356761_to_361517,གདོང་ལེན་བྱེད་དགོས་པ་གསུངས་འདུག། ཐེངས་འདིའི་སྐུ་ཚབ་ཚོགས་ཆུང་འདིའི་ནང་ལ་བོད་དང་ཐའེ་ཝན་གི་ ,gdong len byed dgos pa gsungs 'dug/_thengs 'di'i sku tshab tshogs chung 'di'i nang la bod dang tha'e wan gi _,https://d38pmlk0v88drf.cloudfront.net/wav16k/STT_NW0030_0056_356761_to_361517.wav,STT_NW,2,89,4.756,wav16k/STT_NW0030_0056_356761_to_361517.wav,གདོང་ལེན་བྱེད་དགོས་པ་གསུངས་འདུག ཐེངས་འདིའི་སྐུ་ཚབ་ཚོགས་ཆུང་དེའི་ནང་ལ་བོད་དང་ཐེ་ཝན་གི་
STT_NW0030_0057_361517_to_366770,འགྲོ་བ་མིའི་ཐོབ་ཐང་འབྲེལ་མཐུན་ཁང་གི་ཚོགས་གཙོ་ཝོས་ཧའོ་ཅིང་ལགས་དང་སྤྱི་ཁྱབ་དྲུང་ཆེན་བཀྲ་ཤིས་ཚེ་རིང་ལགས།  ,'gro ba mi'i thob thang 'brel mthun khang gi tshogs gtso wos ha'o cing lags dang spyi khyab drung chen bkra shis tshe ring lags/__,https://d38pmlk0v88drf.cloudfront.net/wav16k/STT_NW0030_0057_361517_to_366770.wav,STT_NW,2,103,5.253,wav16k/STT_NW0030_0057_361517_to_366770.wav,འགྲོ་བ་མིའི་ཐོབ་ཐང་འབྲེལ་མཐུད་ཁང་གི་ཚོགས་གཙོ་ཝུ་ཧའོ་ཅིང་ལགས་དང་སྤྱི་ཁྱབ་དྲུང་ཆེ་བཀྲ་ཤིས་ཚེ་རིང་ལགས་
STT_MV0483_0015_196367_to_204294,ཁོང་གིས་རྒྱལ་སྲས་གཞོན་ནུ་དོན་གྲུན་མཇལ་འཕྲད་ལ་གདན་འདྲེན་ཞུས་ཚར་ཤག རྒྱལ་སྲས་གཞོན་ནུ་དོན་གྲུབ་ཨེ། ད་ག་རེད་རྒྱལ་པོ་མཆོག ,khong gis rgyal sras gzhon nu don grun mjal 'phrad la gdan 'dren zhus tshar shag_rgyal sras gzhon nu don grub e/_da ga red rgyal po mchog_,https://d38pmlk0v88drf.cloudfront.net/wav16k/STT_MV0483_0015_196367_to_204294.wav,STT_MV,2,116,7.927,wav16k/STT_MV0483_0015_196367_to_204294.wav,ཁོང་གིས་རྒྱལ་སྲས་གཞོན་ནུ་དོན་གྲུབ། མཇལ་འཕྲད་ལ་གདན་འདྲེན་ཞུས་ཚར་ཤག རྒྱལ་སྲས་གཞོན་ནུ་དོན་གྲུབ་ཨེ། ད་ག་རེད་རྒྱལ་པོ་མཆོག
STT_NW0030_0058_366770_to_368955,ཚོགས་པའི་རྒྱུན་ལས་ལེན་ལགས་དང་ད་ག་ནང་བཞིན་ ,tshogs pa'i rgyun las len lags dang da ga nang bzhin _,https://d38pmlk0v88drf.cloudfront.net/wav16k/STT_NW0030_0058_366770_to_368955.wav,STT_NW,2,42,2.185,wav16k/STT_NW0030_0058_366770_to_368955.wav,ཚོགས་པའི་རྒྱུན་ལས་ལིན་ལགས་ད་ག་ནང་བཞིན་
STT_NW0030_0059_368955_to_378725,ཐའེ་ཝན་དུ་རྟེན་གཞི་བྱེད་པའི་རྒྱ་ནག་ལ་ཁ་གཏད་གཅོག་མཁན་གི་ཧོང་ཀོང་གཞོན་སྐྱེས་ཚོགས་པ་གསར་འཛུགས་གནང་མཁན་སི་ཀའེ་ཧྥོན་ལགས་དང་། ཐའེ་ཝན་ནང་གི་ཁྲིམས་དོན་དང་འབྲེལ་བའི་གཞུང་འབྲེལ་མིན་པའི་ཚོགས་པའི་རྒྱུན་ལས་ ,tha'e wan du rten gzhi byed pa'i rgya nag la kha gtad gcog mkhan gi hong kong gzhon skyes tshogs pa gsar 'dzugs gnang mkhan si ka'e h+phon lags dang /_tha'e wan nang gi khrims don dang 'brel ba'i gzhung 'brel min pa'i tshogs pa'i rgyun las _,https://d38pmlk0v88drf.cloudfront.net/wav16k/STT_NW0030_0059_368955_to_378725.wav,STT_NW,2,194,9.77,wav16k/STT_NW0030_0059_368955_to_378725.wav,ཐའེ་ཝན་དུ་རྟེན་གཞི་བྱས་པའི་རྒྱ་ནག་ལ་ཁ་གཏད་གཅོག་མཁན་གི་ཧོང་ཀོང་གཞོན་སྐྱེས་ཚོགས་པ་གསར་འཛུགས་གནང་མཁན་སྀཁའི་ཧྥུང་ལགས་དང་ཐའེ་ཝན་ནང་གི་ཁྲིམས་དོན་དང་འབྲེལ་བའི་གཞུང་འབྲེལ་མིན་པའི་ཚོགས་པའི་རྒྱུན་ལས་
STT_NW0030_0060_378725_to_381203,ཚའེ་མིན་ཛིས་ལགས་བཅས་མཉམ་བཞུགས་གནང་འདུག།  ,tsha'e min dzis lags bcas mnyam bzhugs gnang 'dug/__,https://d38pmlk0v88drf.cloudfront.net/wav16k/STT_NW0030_0060_378725_to_381203.wav,STT_NW,2,41,2.478,wav16k/STT_NW0030_0060_378725_to_381203.wav,ཚའི་མིང་རྩི་ལགས་བཅས་མཉམ་ཞུགས་གནང་འདུག
STT_NW0030_0061_381203_to_390289,བོད་མིའི་སྒྲིག་འཛུགས་འཕྲོད་བསྟེན་ལས་ཁུངས་ཀིས་མ་དང་བྱིས་བའི་འཕྲོད་བསྟེན་ཚན་པའི་ངོས་ནས་རྒྱ་གར་ནང་གི་བོད་མི་གཞིས་ཆགས་ཁག་ཏུ་མ་དང་བྱིས་པ་རྣམས་ལ་ཟས་བཅུད་འཚོ་སྣོན་མཁོ་སྤྲོད་གནང་འདུག།  ,bod mi'i sgrig 'dzugs 'phrod bsten las khungs kis ma dang byis ba'i 'phrod bsten tshan pa'i ngos nas rgya gar nang gi bod mi gzhis chags khag tu ma dang byis pa rnams la zas bcud 'tsho snon mkho sprod gnang 'dug/__,https://d38pmlk0v88drf.cloudfront.net/wav16k/STT_NW0030_0061_381203_to_390289.wav,STT_NW,2,177,9.086,wav16k/STT_NW0030_0061_381203_to_390289.wav,བོད་མིའི་སྒྲིག་འཛུགས་འཕྲོད་བསྟེན་ལས་ཁུངས་ཀི་མ་དང་བྱིས་པའི་འཕྲོད་བསྟེན་ཚན་པའི་ངོས་ནས་ རྒྱ་གར་ནང་གི་བོད་མིའི་གཞིས་ཆགས་ཁག་ཏུ་མ་དང་བྱིས་པ་རྣམས་ལ་ཟས་ྱུའི་འཚོ་སྣོན་མཁོ་སྤྲོད་གནང་འདུག།
STT_NW0030_0062_390289_to_399914,དེ་ཡང་བོད་མིའི་སྒྲིག་འཛུགས་འཕྲོད་བསྟེན་ལས་ཁུངས་ནས་ལོ་ལྟར་བཞིན་མ་དང་བྱིས་བའི་འཕྲོད་བསྟེན་ལ་དམིགས་པའི་ལས་འགུལ་སྣ་མང་ཞིག་སྤེལ་བཞིན་ཡོད་པ་དང་། ལས་གཞི་དེའི་ཁུངས་སུ་ཕྲུ་གུ་མ་བཙས་གོང་དང་བཙས་བའི་རྗེས་སུ་ ,de yang bod mi'i sgrig 'dzugs 'phrod bsten las khungs nas lo ltar bzhin ma dang byis ba'i 'phrod bsten la dmigs pa'i las 'gul sna mang zhig spel bzhin yod pa dang /_las gzhi de'i khungs su phru gu ma btsas gong dang btsas ba'i rjes su _,https://d38pmlk0v88drf.cloudfront.net/wav16k/STT_NW0030_0062_390289_to_399914.wav,STT_NW,2,196,9.625,wav16k/STT_NW0030_0062_390289_to_399914.wav,དེ་ཡང་བོད་མིའི་སྒྲིག་འཛུགས་འཕྲོད་བསྟེན་ལས་ཁུངས་ནས་ལོ་ལྟར་བཞིན་མ་དང་ཕྱིས་པའི་འཕྲོད་བསྟེན་ལ་སྨན་པའི་ལས་གཞིའི་རྣ་མང་ཞིག་སྤེལ་བཞིན་ཡོད་པ་དང་། ལས་གཞི་འདིའི་ཁོངས་སུ་ཕྲུ་གུ་མ་རྩས་གོང་དང་བྩས་པའི་རྗེས་སུ་
STT_NW0030_0063_399914_to_406664,ཕྲུ་གུ་ལ་སྨན་པའི་ཞབས་ཞུ་དང་། ལོ་ན་ལྔ་མན་གི་བྱིས་པ་རྣམས་ལ་སྔོན་ཁབ་དང་། ད་ག་ནང་བཞིན་ཟས་བཅུད་འཚོ་སྣོན་མཁོ་སྤྲོད་གནང་གི་ཡོད་པ་རེད་འདུག།  ,phru gu la sman pa'i zhabs zhu dang /_lo na lnga man gi byis pa rnams la sngon khab dang /_da ga nang bzhin zas bcud 'tsho snon mkho sprod gnang gi yod pa red 'dug/__,https://d38pmlk0v88drf.cloudfront.net/wav16k/STT_NW0030_0063_399914_to_406664.wav,STT_NW,2,133,6.75,wav16k/STT_NW0030_0063_399914_to_406664.wav,ཕྲུ་གུ་ལ་སྨན་པའི་ཞབས་ཞུ་དང་ལོ་ན་ལྔ་མིན་གི་བྱིས་པ་རྣམས་ལ་སྔོང་སྐབས། ད་ག་ནང་བཞིན་ཟས་ྱུའི་འཚོ་སྣོན་མཁོ་སྤྲོད་གནང་གི་ཡོད་པ་རེད་འདུག
STT_NW0030_0064_406664_to_413761,འཕྲོད་བསྟེན་ལས་ཁུངས་ནས་སྦྲུམ་མ་དང་ལོ་ན་གཉིས་ཅན་གི་བྱིས་པ་ཡོད་པའི་ཨ་མ་ཚོ་ལ། ཟླ་བ་གཉིས་རེས་མཚམས་སུ་འཚོ་སྣོན་གནང་གི་ཡོད་འདུག་བཅས་ ,'phrod bsten las khungs nas sbrum ma dang lo na gnyis can gi byis pa yod pa'i a ma tsho la/_zla ba gnyis res mtshams su 'tsho snon gnang gi yod 'dug bcas _,https://d38pmlk0v88drf.cloudfront.net/wav16k/STT_NW0030_0064_406664_to_413761.wav,STT_NW,2,127,7.097,wav16k/STT_NW0030_0064_406664_to_413761.wav,འཕྲོད་བསྟེན་ལས་ཁུངས་ནས་སྦྲུམ་མ་དང་ལོ་ན་གཉིས་ཅན་གི་བྱིས་པ་ཡོད་པའི་ཨ་མ་ཚོ་ལ་ ཟླ་བ་གཉིས་རེའི་མཚམས་སུ་འཚོ་གནོད་གནང་གི་ཡོད་འདུག་ཅིང་།
STT_NW0030_0065_413761_to_418242,དེ་ཡང་གཙོ་བོ་སྦྲུམ་མའི་གནས་སྐབས་སུ་ནད་གཞིའི་རིགས་སྔོན་འགོག་ཡོང་ཐབས་རིགས་ཡིན་པ་རེད་འདུག་ ,de yang gtso bo sbrum ma'i gnas skabs su nad gzhi'i rigs sngon 'gog yong thabs rigs yin pa red 'dug _,https://d38pmlk0v88drf.cloudfront.net/wav16k/STT_NW0030_0065_413761_to_418242.wav,STT_NW,2,88,4.481,wav16k/STT_NW0030_0065_413761_to_418242.wav,དེ་ཡང་གཙོ་བོ་སྦྲུམ་མའི་གནས་སྐབས་སུ་ནད་གཞིའི་རིགས་སྔོན་འགོག་ཡོང་ཐབས་ལད་ཡིན་པ་རེད་འདུག
STT_MV0483_0016_204294_to_210405,ཁྱེད་རང་གིས་གཞོན་ནུ་དོན་གྲུབ་ཀྱི་རྟེན་འབྲེལ་སྒང་ལ། ཁོ་ན་གཉིས་འབྲེལ་བ་ཡག་པོ་ཡོད་པ་གཟིགས་ཡོད་ཀྱི་རེད། ཕལ་ཆེར།  ,khyed rang gis gzhon nu don grub kyi rten 'brel sgang la/_kho na gnyis 'brel ba yag po yod pa gzigs yod kyi red/_phal cher/__,https://d38pmlk0v88drf.cloudfront.net/wav16k/STT_MV0483_0016_204294_to_210405.wav,STT_MV,2,109,6.111,wav16k/STT_MV0483_0016_204294_to_210405.wav,ཁྱེད་རང་གིས་གཞོན་ནུ་དོན་གྲུབ་ཀི་རྟེན་འབྲེལ་སྒང་ལ། ཁོ་རང་གཉིས་འབྲེལ་བ་ཡག་པོ་ཡོད་པ་གཟིགས་ཡོད་ཀྱི་རེད། ཕལ་ཆེར།
STT_TT00817_0069_502517_to_506800,དེ་ལ་ཡ་འདུག་སེ་བྱས་ནས་གསུང་སྟངས་དེ་ག་རེ་རེད་ཟེ་ན། གཞན་དག་གིས་ཟེ་དུས་སློབ་དཔོན་དབང་ཕྱུག་སྡེ།  ,de la ya 'dug se byas nas gsung stangs de ga re red ze na/_gzhan dag gis ze dus slob dpon dbang phyug sde/__,https://d38pmlk0v88drf.cloudfront.net/wav16k/STT_TT00817_0069_502517_to_506800.wav,STT_TT,2,93,4.283,wav16k/STT_TT00817_0069_502517_to_506800.wav,དེ་ལ་ཡ་འདུག་སེ་བྱས་ནས་གསུང་སྟངས་དེ་ག་རེ་རེད་ཟེར་ན། གཞན་དག་གིས་ཟེར་དུས། སློབ་དཔོན་དབང་ཕྱུག་སྡེ།
STT_TT00817_0071_512738_to_519411,རྟགས་མི་མཐུན་ཕྱོགས་མཐའ་དག་ལ་མེད་ངེས་སུ་གྲུབ་དགོས་ན་དེ་ལ་ཡོད་ན་དམིགས་རུང་དུ་ཐལ་ཟེ་རེད་བ། མི་མཐུན་ཕྱོགས་ལ་ཡོད་ན་ཨེ་ནས།  ,rtags mi mthun phyogs mtha' dag la med nges su grub dgos na de la yod na dmigs rung du thal ze red ba/_mi mthun phyogs la yod na e nas/__,https://d38pmlk0v88drf.cloudfront.net/wav16k/STT_TT00817_0071_512738_to_519411.wav,STT_TT,2,118,6.673,wav16k/STT_TT00817_0071_512738_to_519411.wav,རྟགས་མི་མཐུན་ཕྱོགས་མཐའ་དག་ལ་མེད་ངེས་སུ་གྲུབ་དགོས་ན། དེ་ལ་ཡོད་ན་དམིགས་རུང་དུ་ཐལ་ཟེ། རེད་བ། མི་མཐུན་ཕྱོགས་ལ་ཡོད་ན། ཨེ་ནས།
STT_TT00817_0072_522124_to_525827,འདོད་ན་ཨ་མི་མཐུན་ཕྱོགས་མཐའ་དག་ལ་ཆོས་ཅན། མཐའ་དག་ཆོས་ཅན།  ,'dod na a mi mthun phyogs mtha' dag la chos can/_mtha' dag chos can/__,https://d38pmlk0v88drf.cloudfront.net/wav16k/STT_TT00817_0072_522124_to_525827.wav,STT_TT,2,56,3.703,wav16k/STT_TT00817_0072_522124_to_525827.wav,འདོད་ན། ཨ་མི་མཐུན་ཕྱོགས་མཐའ་དག་ལ་ཆོས་ཅན་མཐའ་དག་ཆོས་ཅན།
STT_TT00817_0073_527792_to_530704,ཡོད་ན་དམིགས་སུ་རུང་བ་ལས་མ་དམིགས་པའི་ཕྱིར་ཞེས་པར་འགྱུར་ལ་ཟེ།  ,yod na dmigs su rung ba las ma dmigs pa'i phyir zhes par 'gyur la ze/__,https://d38pmlk0v88drf.cloudfront.net/wav16k/STT_TT00817_0073_527792_to_530704.wav,STT_TT,2,61,2.912,wav16k/STT_TT00817_0073_527792_to_530704.wav,ཡོད་ན་དམིགས་སུ་རུང་བ་ལས་མ་དམིགས་པའི་ཕྱིར་ཞེས་པར་འགྱུར་ལ་ཟེ།
STT_NW0030_0066_418242_to_426241,མ་ཟད་ལས་གཞི་དེ་བཞིན་མ་དང་བྱིས་པའི་འཕྲོད་བསྟེན་ལ་གཞོགས་འདེགས་དང་། ད་ག་ནང་བཞིན་བོད་མིའི་མི་འབོར་འཕེལ་རྒྱས་ལ་ཕན་པའི་ཐུགས་བསམ་བཞེས་གནང་བ་ཞིག་རེད་འདུག།  ,ma zad las gzhi de bzhin ma dang byis pa'i 'phrod bsten la gzhogs 'degs dang /_da ga nang bzhin bod mi'i mi 'bor 'phel rgyas la phan pa'i thugs bsam bzhes gnang ba zhig red 'dug/__,https://d38pmlk0v88drf.cloudfront.net/wav16k/STT_NW0030_0066_418242_to_426241.wav,STT_NW,2,148,7.999,wav16k/STT_NW0030_0066_418242_to_426241.wav,མ་ཟད་ལས་གཞི་འདི་བཞིན་མ་དང་བྱིས་པའི་འཕྲོད་བསྟེན་ལས་གཞོགས་འདེགས་དང་། ད་ག་ནང་བཞིན་བོད་མིའི་མི་འབོར་འཕེལ་རྒྱས་ལ་ཕན་པའི་ཆེད་དུ་ཐུགས་བསམ་བཞེས་གནང་བ་ཞིག་རེད་འདུག
STT_NW0030_0067_426241_to_436240,ཐའེ་ཝན་གི་གྲོང་ཁྱེར་ཐའེ་བྷེར་སྐོང་ཚོགས་གནང་བའི་ཕྱི་ལོ་ཉིས་སྟོང་ཉི་ཤུ་རྩ་གསུམ་ལོར་ཨེ་ཤེ་ཡ་དང་ཞི་བདེ་རྒྱ་མཚོའི་མངའ་ཁུལ་རྒྱལ་སྤྱིའི་འགྲོ་བ་མིའི་ཐོབ་ཐང་དང་འབྲེལ་བའི་འགྲེམ་སྟོན་ཁང་གི་མཐུན་ཚོགས་ཀི་ཚོགས་འདུར་ ,tha'e wan gi grong khyer tha'e b+her skong tshogs gnang ba'i phyi lo nyis stong nyi shu rtsa gsum lor e she ya dang zhi bde rgya mtsho'i mnga' khul rgyal spyi'i 'gro ba mi'i thob thang dang 'brel ba'i 'grem ston khang gi mthun tshogs ki tshogs 'dur _,https://d38pmlk0v88drf.cloudfront.net/wav16k/STT_NW0030_0067_426241_to_436240.wav,STT_NW,2,202,9.999,wav16k/STT_NW0030_0067_426241_to_436240.wav,ཐའེ་ཝན་གི་གྲོང་ཁྱེར་ཐའེ་བེར་སྐོང་ཚོགས་གནང་བའི་ཕྱི་ལོ་ཉིས་སྟོང་ཉི་ཤུ་རྩ་གསུམ་ལོའི་ཨེ་ཤེ་ཡ་དང་ཞི་བདེ་རྒྱ་མཚོའི་མངའ་ཁུལ་རྒྱལ་སྤྱིའི་འགྲོ་བ་མིའི་ཐོབ་ཐང་དང་འབྲེལ་བའི་འགྲེམ་སྟོན་ཁང་གི་མཐུན་ཚོགས་ཀི་ཚོགས་འདུར་
STT_MV0483_0017_210405_to_218516,རྒྱལ་པོ་གཟུགས་ཅན་སྙིང་པོས་ཤཱཀྱའི་རིགས་དང་འབྲེལ་ཡག་ཏུ་གཏོང་འདོད་ཡོད་པ་འདྲ། བྱས་ན།  ,rgyal po gzugs can snying pos shAkya'i rigs dang 'brel yag tu gtong 'dod yod pa 'dra/_byas na/__,https://d38pmlk0v88drf.cloudfront.net/wav16k/STT_MV0483_0017_210405_to_218516.wav,STT_MV,2,82,8.111,wav16k/STT_MV0483_0017_210405_to_218516.wav,རྒྱལ་པོ་གཟུགས་ཅན་སྙིང་པོས་ཤཱཀྱའི་རིགས་དང་། འབྲེལ་བ་ཡག་རུ་གཏང་འདོད་ཡོད་པ་འདྲ། བྱས་ན།
STT_NW0030_0068_436240_to_441086,ཕྱི་འབྲེལ་ལས་ཁུངས་ཁྱབ་ཁོངས་ཀི་བོད་ཀི་འགྲེམ་སྟོན་ཁང་གི་འགན་འཛིན་བསྟན་འཛིན་སྟོབས་ལྡན་ལགས་མཉམ་ཞུགས་ཀིས་ ,phyi 'brel las khungs khyab khongs ki bod ki 'grem ston khang gi 'gan 'dzin bstan 'dzin stobs ldan lags mnyam zhugs kis _,https://d38pmlk0v88drf.cloudfront.net/wav16k/STT_NW0030_0068_436240_to_441086.wav,STT_NW,2,101,4.846,wav16k/STT_NW0030_0068_436240_to_441086.wav,ཕྱི་དྲིལ་ལས་ཁུངས་རྒྱབ་ཁོངས་བོད་ཀི་འགྲེམ་སྟོན་ཁང་གི་འགན་འཛིན་བསྟན་འཛིན་སྟོབས་ལྡན་ལགས་མཉམ་ཞུགས་ཀིས་
STT_NW0030_0069_441086_to_444013,བོད་དོན་སྤྱི་དང་བྱེ་བྲག་ཏུ་བོད་ནང་གི་ཛ་དྲག་གནས་སྟངས་དང་ ,bod don spyi dang bye brag tu bod nang gi dza drag gnas stangs dang _,https://d38pmlk0v88drf.cloudfront.net/wav16k/STT_NW0030_0069_441086_to_444013.wav,STT_NW,2,56,2.927,wav16k/STT_NW0030_0069_441086_to_444013.wav,བོད་དོན་སྤྱི་དང་བྱེ་བྲག་ཏུ་བོད་ནང་གི་ཛ་དྲག་གནས་སྟངས་དང་
STT_NW0030_0070_444013_to_453440,བོད་ཀི་རང་དབང་ཆེད་དུ་མི་གྲངས་བརྒྱ་དང་ལྔ་བཅུ་ལྔ་བདུན་ལྷག་ནས་རང་ལུས་མེར་བསྲེགས་བཏང་བའི་སྐོར་ངོ་སྤྲོད་དང་སྦྲགས། རྒྱ་ནག་གཞུང་གིས་དབང་བསྒྱུར་འོག་བོད་ནང་གི་འགྲོ་བ་མིའི་ཐོབ་ཐང་རྡོག་རོལ་གཏོང་བཞིན་པའི་གནས་སྟངས་དེ་དག་ ,bod ki rang dbang ched du mi grangs brgya dang lnga bcu lnga bdun lhag nas rang lus mer bsregs btang ba'i skor ngo sprod dang sbrags/_rgya nag gzhung gis dbang bsgyur 'og bod nang gi 'gro ba mi'i thob thang rdog rol gtong bzhin pa'i gnas stangs de dag _,https://d38pmlk0v88drf.cloudfront.net/wav16k/STT_NW0030_0070_444013_to_453440.wav,STT_NW,2,208,9.427,wav16k/STT_NW0030_0070_444013_to_453440.wav,བོད་ཀི་རང་དབང་ཆེད་དུ་མི་གྲངས་བརྒྱ་དང་ལྔ་བཅུ་ལང་བདུན་ལྷག་ནས་རང་ལུས་མེར་བསྲེགས་བཏང་བའི་སྐོར་ངོ་སྤྲོད་དང་སྦྲགས། རྒྱ་ནག་གཞུང་གིས་དབང་བསྒྱུར་འོག་བོད་ནང་གི་འགྲོ་བ་མིའི་ཐོབ་ཐང་རྡོག་རོལ་གཏོང་བཞིན་པའི་གནས་སྟངས་དེ་དག་
STT_NW0030_0071_453440_to_457668,བོད་ཀི་འགྲེམ་སྟོན་ཁང་ནས་དྲིལ་བསྒྲགས་ཞུ་གཏུགས་གནང་གི་ཡོད་སྐོར་འབྲེལ་བརྗོད་གནང་གི་འདུག།  ,bod ki 'grem ston khang nas dril bsgrags zhu gtugs gnang gi yod skor 'brel brjod gnang gi 'dug/__,https://d38pmlk0v88drf.cloudfront.net/wav16k/STT_NW0030_0071_453440_to_457668.wav,STT_NW,2,87,4.228,wav16k/STT_NW0030_0071_453440_to_457668.wav,བོད་ཀི་འགྲེམ་སྟོན་ཁང་ནི་དྲིལ་བསྒྲགས་ཞུ་གཏུགས་གནང་གི་ཡོད་སྐོར་འགྲེལ་བརྗོད་གནང་འདུག
STT_NW0030_0072_457668_to_462709,ཚོགས་འདུ་དེའི་ཐོག་ལ་ཐའེ་ཝན་གཞུང་གི་རིག་གཞུང་བློན་ཆེན་གཞོན་པ་སུའུ་ཝན་ལགས་དང་ ,tshogs 'du de'i thog la tha'e wan gzhung gi rig gzhung blon chen gzhon pa su'u wan lags dang _,https://d38pmlk0v88drf.cloudfront.net/wav16k/STT_NW0030_0072_457668_to_462709.wav,STT_NW,2,76,5.041,wav16k/STT_NW0030_0072_457668_to_462709.wav,ཚོགས་འདུ་དིའི་ཐོག་ལ་ཐའེ་ཝན་གཞུང་གིས་རིག་གཞུང་བློན་ཆེན་གཞོན་པ་སུའུ་ཝན་ལགས་དང་
