file_name,uni,wylie,url,dept,grade,char_len,audio_len,path,inf
STT_NW0032_0077_503211_to_510024,ཞིབ་བཤེར་གནང་གི་ཡོད་པ་ནང་བཞིན། སྤྱི་འཐུས་རྒྱུན་ལས་སྡེ་ཚན་སོ་སོས་སྔོན་ཚུན་ནས་ལས་བསྡོམས་རྒྱས་པ་ཚང་མ་ལ་ཞིབ་བཤེར་གནང་ནས་ ,zhib bsher gnang gi yod pa nang bzhin/_spyi 'thus rgyun las sde tshan so sos sngon tshun nas las bsdoms rgyas pa tshang ma la zhib bsher gnang nas _,https://d38pmlk0v88drf.cloudfront.net/wav16k/STT_NW0032_0077_503211_to_510024.wav,STT_NW,2,117,6.813,wav16k/STT_NW0032_0077_503211_to_510024.wav,ཞིབ་བཤེར་གནང་གི་ཡོད་པ་ནང་བཞིན། སྤྱི་འཐུས་རྒྱུན་ལས་སྡེ་ཚན་སོ་སོས་སྔོན་ཚུད་ནས་ལས་བསྡོམས་རྒྱས་པ་ཚང་མ་ལ་ཡ་ཞིབ་བཤེར་གནང་ནས་
STT_NW0032_0078_510024_to_514090,ཨེ་ནས་དེའི་ཐོག་ལ་ཡ་སྙན་ཐོ་ཟུར་དུ་འདུག་སེ་ཕུལ་གི་རེད།  ,e nas de'i thog la ya snyan tho zur du 'dug se phul gi red/__,https://d38pmlk0v88drf.cloudfront.net/wav16k/STT_NW0032_0078_510024_to_514090.wav,STT_NW,2,54,4.066,wav16k/STT_NW0032_0078_510024_to_514090.wav,ཨེ་ནས་དེའི་ཐོག་ལ་ཡ་སྙན་ཐོ་ཟུར་དུ་འདུག་སེ་ཕུལ་གི་རེད།
STT_NW0032_0079_514090_to_520589,ཨེ་ནས་དེའི་སྒང་ལ་ལས་བསྡོམས་སྙིང་བསྡུས་རེ། ཨེ་ནས་ལས་ཁུངས་སོ་སོ་ཨེ་ནས་བཀའ་བློན་ནས་སྙན་སྒྲོན་གནང་།  ,e nas de'i sgang la las bsdoms snying bsdus re/_e nas las khungs so so e nas bka' blon nas snyan sgron gnang /__,https://d38pmlk0v88drf.cloudfront.net/wav16k/STT_NW0032_0079_514090_to_520589.wav,STT_NW,2,97,6.499,wav16k/STT_NW0032_0079_514090_to_520589.wav,ཨེ་ནས་དེའི་སྒང་ལ་ལས་བསྡོམས་སྙིང་བསྡུས་རེད། ཨེ་ནས་ལས་ཁུངས་སོ་སོའི་ེ་ས་བཀའ་བློན་ནས་སྙན་སྒྲོན་གནང་།
STT_NW0032_0080_520589_to_525928,འདིའི་སྒང་ལ་ཨེ་ནས་སྤྱི་འཐུས་རྒྱུན་ལས་ནས་ཞིབ་བཤེར་གནང་བའི་ཨེ་ནས་དྲི་བ་ཁག་དེ་གས་བྱས།  ,'di'i sgang la e nas spyi 'thus rgyun las nas zhib bsher gnang ba'i e nas dri ba khag de gas byas/__,https://d38pmlk0v88drf.cloudfront.net/wav16k/STT_NW0032_0080_520589_to_525928.wav,STT_NW,2,84,5.339,wav16k/STT_NW0032_0080_520589_to_525928.wav,དེའི་སྒང་ལ་ཨེ་ནས་སྤྱི་འཐུས་རྒྱུན་ལས་ནས་ཞིབ་བཤེར་གནང་པའི་ཨེ་ནས་དྲི་བ་ཁག་དེ་གས་བྱས།
STT_NW0032_0081_525928_to_532700,ཨེ་ནས་དེ་གས་ཞིབ་འཇུག་བྱས་ནས་ཨེ་ནས་ག་རེ་ཟེར་དགོས་རེ། གྲོས་ཚོགས་ནང་ལ་ཡ་ཞིབ་བཤེར་དང་བགྲོ་གླེང་གི་ལས་རིམ་གཅིག་འགྲོ་གི་རེད།  ,e nas de gas zhib 'jug byas nas e nas ga re zer dgos re/_gros tshogs nang la ya zhib bsher dang bgro gleng gi las rim gcig 'gro gi red/__,https://d38pmlk0v88drf.cloudfront.net/wav16k/STT_NW0032_0081_525928_to_532700.wav,STT_NW,2,120,6.772,wav16k/STT_NW0032_0081_525928_to_532700.wav,ཨེ་ནས་དེ་གས་ཆབ་ཇིག་བྱས་ནས་ཨེ་ནས་ག་རེ་ཟེར་དགོས་རེད། གྲོས་ཚོགས་ནང་ལ་ཡ་ཞིབ་བཤེར་དང་བགྲོ་གླེང་གི་ལས་རིམ་གཅིག་འགྲོ་གི་རེད།
STT_TT00773_0182_1234291_to_1237139,སྡོམ་དེ་མ་བྱུང་པ་རེད། ད་སྡོམ་དེ་ད་དགོས་ཡ་རྩ་བ་ནས། རྟགས་བརྒྱབ་ ,sdom de ma byung pa red/_da sdom de da dgos ya rtsa ba nas/_rtags brgyab _,https://d38pmlk0v88drf.cloudfront.net/wav16k/STT_TT00773_0182_1234291_to_1237139.wav,STT_TT,2,62,2.848,wav16k/STT_TT00773_0182_1234291_to_1237139.wav,སྡོམ་དེ་ཡེ་མ་བྱུང་པ་རེད། ད་སྡོམ་དེ་ད་དགོས་ཡའི་རྩ་ནས་རྟགས་བརྒྱབ།
STT_TT00773_0185_1257933_to_1261197,སྔགས་སྡོམ་དགོས་ཡ་མ་རེད། གསང་གསང་། ག་བོ་ས་ང་གསང་ཆད་སོང་བ་རེད།  ,sngags sdom dgos ya ma red/_gsang gsang /_ga bo sa nga gsang chad song ba red/__,https://d38pmlk0v88drf.cloudfront.net/wav16k/STT_TT00773_0185_1257933_to_1261197.wav,STT_TT,2,62,3.264,wav16k/STT_TT00773_0185_1257933_to_1261197.wav,སྔགས་སྡོམ་དགོས་ཡ་མ་རེད། གསང་། གསང་། གའོ་སང་ང་སང་ཆད་སོང་བ་རེད།
STT_TT00773_0186_1261549_to_1265389,གསང་སྔགས་བླ་མེད་ཀྱི་ས་དང་པོའི་ཡེ་ཤེས་ཆོས་ཅན་ཟེ་རེད། སྡོམ་དེ་ ,gsang sngags bla med kyi sa dang po'i ye shes chos can ze red/_sdom de _,https://d38pmlk0v88drf.cloudfront.net/wav16k/STT_TT00773_0186_1261549_to_1265389.wav,STT_TT,2,61,3.84,wav16k/STT_TT00773_0186_1261549_to_1265389.wav,གསང་སྔགས་བླ་མེད་ཀྱི་ས་དང་པོའི་ཡེ་ཤེས་ཆོས་ཅན་ཟེར་རེད། སྡོམ་དེ།
STT_TT00773_0187_1268831_to_1273919,སྔགས་ཀི་གོང་ལ་ག་བོ་གསའ་ང་གསང་། གསང་སྔགས་བླ་མེད་ཀྱི་ས་དང་པོའི་ཡེ་ཤེས་ཆོས་ཅན།  ,sngags ki gong la ga bo gsa' nga gsang /_gsang sngags bla med kyi sa dang po'i ye shes chos can/__,https://d38pmlk0v88drf.cloudfront.net/wav16k/STT_TT00773_0187_1268831_to_1273919.wav,STT_TT,2,77,5.088,wav16k/STT_TT00773_0187_1268831_to_1273919.wav,སྔགས་སྒོང་ལ་གའོ་གསང་ང་གསང་། གསང་སྔགས་བླ་མེད་ཀྱི་ས་དང་པོའི་ཡེ་ཤེས་ཆོས་ཅན།
STT_TT00773_0188_1274399_to_1277311,ཨེ་ནས། ས་དང་པོ་རབ་ཏུ་དགའ་བའི་ས་ཡིན་པས་ཁྱབ་པ་དེར་ཐལ།  ,e nas/_sa dang po rab tu dga' ba'i sa yin pas khyab pa der thal/__,https://d38pmlk0v88drf.cloudfront.net/wav16k/STT_TT00773_0188_1274399_to_1277311.wav,STT_TT,2,53,2.912,wav16k/STT_TT00773_0188_1274399_to_1277311.wav,ཨེ་ནས། ས་དང་པོ་རབ་ཏུ་དགའ་བའི་ས་ཡིན་པས་ཁྱབ་པ་དེར་ཐལ།
STT_TT00773_0189_1277535_to_1281567,ས་དང་པོ་གནས་ཀྱི་ས་ཡིན་པ་དེའི་ཕྱིར་ཏེ་ཟེ། ཏ་འགྲེང་བུ་ཏེ་ཆད་ཏེ།  ,sa dang po gnas kyi sa yin pa de'i phyir te ze/_ta 'greng bu te chad te/__,https://d38pmlk0v88drf.cloudfront.net/wav16k/STT_TT00773_0189_1277535_to_1281567.wav,STT_TT,2,63,4.032,wav16k/STT_TT00773_0189_1277535_to_1281567.wav,ས་དང་པོ་གནས་ཀྱི་ས་ཡིན་པ་དེའི་ཕྱིར་ཏེ་ཟེ། རྟ་འབྲེང་བུ་དེ་ཆད་ཏེ།
STT_TT00773_0153_1052534_to_1058575,དཱ་དེ་ནས། ཨེ། ཉེ་གནས་ཀི་ས་ཡིན་ན། ས་དྲི་མ། ས་གཉིས་པ་དྲི་མ་མེད་པའི་ས་ཡིན་པས་ཁྱབ་པ་རེད། ག་རེ་ཟེར་ན།  ,dA de nas/_e/_nye gnas ki sa yin na/_sa dri ma/_sa gnyis pa dri ma med pa'i sa yin pas khyab pa red/_ga re zer na/__,https://d38pmlk0v88drf.cloudfront.net/wav16k/STT_TT00773_0153_1052534_to_1058575.wav,STT_TT,2,98,6.041,wav16k/STT_TT00773_0153_1052534_to_1058575.wav,ད་དེ་ནས། ཨེ། ཉེ་གནས་ཀི་ས་ཡིན་ན། ས་དྲི། ས་གཉིས་པ་དྲི་མ་མེད་པའི་ས་ཡིན་པས་ཁྱབ་པ་རེད། ག་རེ་ཟེར་ན།
STT_NW0032_0082_534233_to_543284,ད་གཙོ་བོ་འདྲ་བོ་དེ་ད་རེས་འདི་རེད་ད། ནམ་རྒྱུན་འཆར་ཅན་གི་འདི་རེད་བ། དེ་ནས་དེའི་སྒང་ལ་ད་ལྟ་གཅིག། ད་རེས་གྲོས་ཚོགས་ནང་ལ་འདི་བསླེབ་ཀི་རེད། ག་རེ་ཟེར་ཨ།  ,da gtso bo 'dra bo de da res 'di red da/_nam rgyun 'char can gi 'di red ba/_de nas de'i sgang la da lta gcig/_da res gros tshogs nang la 'di bsleb ki red/_ga re zer a/__,https://d38pmlk0v88drf.cloudfront.net/wav16k/STT_NW0032_0082_534233_to_543284.wav,STT_NW,2,146,9.051,wav16k/STT_NW0032_0082_534233_to_543284.wav,ད་གཙོ་བོ་འདྲ་བོ་དེ་ད་རིང་འདི་རེད་ད། ནམ་རྒྱུན་འཆར་ཅན་གི་དེ་རེད་བ། ད་དེ་ནས་དེའི་སྒང་ལ་ཡད་ལྟ་གཅིག ད་རིས་གྲོས་ཚོགས་ནང་ལ་འདི་སླེབས་ཀི་རེད། ག་རེ་ཟ།
STT_NW0032_0083_543284_to_551424,མང་གཙོ་རྩིས་ཁྲ་ཚོགས་ཆུང་སྐབས་དྲུག་པའི་ལས་བསྡོམས། སྙན་ཐོ་དེ་ལ་ཡ་བཀའ་ཤག་གིས་མཇུག་སྐྱོང་གནང་བཞག་པ་གཅིག་ཡོད་རེད།  ,mang gtso rtsis khra tshogs chung skabs drug pa'i las bsdoms/_snyan tho de la ya bka' shag gis mjug skyong gnang bzhag pa gcig yod red/__,https://d38pmlk0v88drf.cloudfront.net/wav16k/STT_NW0032_0083_543284_to_551424.wav,STT_NW,2,110,8.14,wav16k/STT_NW0032_0083_543284_to_551424.wav,མང་གཚོགས་རྩིས་བྲལ་ཚོགས་ཆུང་སྐབས་དྲུག་པའི་ལས་བསྡོམས་སྙན་ཐོ་དེ་ལ་ཡ་ བཀའ་ཤག་གིས་བཞུགས་སྐྱོང་གནང་བཞག་པ་གཅིག་ཡོད་རེད།
STT_NW0032_0084_551424_to_558040,བཀའ་ཤག་གིས་མཇུག་སྐྱོང་གནང་བཞག་པའི་སྙན་ཐོ་དེ་མར་སྤྱི་འཐུས་རྒྱུན་ལས་ལ་འབྱོར་ཚར་རེད། བྱས་ཙང་།  ,bka' shag gis mjug skyong gnang bzhag pa'i snyan tho de mar spyi 'thus rgyun las la 'byor tshar red/_byas tsang /__,https://d38pmlk0v88drf.cloudfront.net/wav16k/STT_NW0032_0084_551424_to_558040.wav,STT_NW,2,92,6.616,wav16k/STT_NW0032_0084_551424_to_558040.wav,བཀའ་ཤག་བཞུགས་སྐྱོང་གནང་བཞག་པའི་སྙན་ཐོ་དེ་མར་སྤྱི་འཐུས་རྒྱུན་ལས་ལ་འབྱོར་ཚར་རེད། བྱས་ཙང་
STT_NW0032_0085_558040_to_567437,སྤྱི་འཐུས་རྒྱུན་ལས་ལ་འབྱོར་ནས། སྤྱི་འཐུས་རྒྱུན་ལས་ནས་ཡང་བསྐྱར་དེའི་ཐོག་ལ་ཨེ་ནས་ཞིབ་འཇུག་དང་། ཨེ་ནས་ལྷན་ཁང་ཚང་མ་ལ་ཨེ་ནས། ད་དུང་ཡང་དེའི་སྒང་ལ་ཡ་བདའ་འདེད་ ,spyi 'thus rgyun las la 'byor nas/_spyi 'thus rgyun las nas yang bskyar de'i thog la e nas zhib 'jug dang /_e nas lhan khang tshang ma la e nas/_da dung yang de'i sgang la ya bda' 'ded _,https://d38pmlk0v88drf.cloudfront.net/wav16k/STT_NW0032_0085_558040_to_567437.wav,STT_NW,2,152,9.397,wav16k/STT_NW0032_0085_558040_to_567437.wav,སྤྱི་འཐུས་རྒྱུན་ལས་ལ་འབྱོར་ནས་ སྤྱི་འཐུས་རྒྱུན་ལས་ནས་ཡང་བསྐྱར་དེའི་ཐོག་ལ་ཡ་ེ་ནས་ཞིབ་འཇུག་དང་། ཨེ་ནས་ལྷན་ཁང་ཚང་མ་ལ་ཡ་ཨེ་ནས་ད་དུང་ཡང་དེའི་སྒང་ལ་ཡ་རྡ་དེད་
STT_TT00773_0155_1064650_to_1074104,དེའི་ཁྱབ་པ་དེ་འགྲིག་གི་ཡོད་མ་རེད། ག་རེ་ཟེར་ན། ས་རབ་ཏུ་དགའ་བ་ཟེར་ན། ཕར་ཕྱིན་ཐེག་པ་རྐྱང་པ་རེད། ས་དང་པོ་གནས་ཀྱི་ས་ཟེར་ན། སྔགས་དང་འབྲེལ་སོང་བ་རེད། དེ་ཁྱབ་ཀི་ཡོད་མ་རེད་ཟེ་གོ་རེད།  ,de'i khyab pa de 'grig gi yod ma red/_ga re zer na/_sa rab tu dga' ba zer na/_phar phyin theg pa rkyang pa red/_sa dang po gnas kyi sa zer na/_sngags dang 'brel song ba red/_de khyab ki yod ma red ze go red/__,https://d38pmlk0v88drf.cloudfront.net/wav16k/STT_TT00773_0155_1064650_to_1074104.wav,STT_TT,2,175,9.454,wav16k/STT_TT00773_0155_1064650_to_1074104.wav,དེ་ཁྱབ་པ་དེ་འགྲིག་གི་ཡོད་མ་རེད། ག་རེ་ཟེར་ན། ས་རབ་ཏུ་དགའ་བ་ཟེར་ན། ཕར་ཕྱིན་ཐེག་པ་རྐྱང་པ་རེད། ས་དང་པོ་གནས་ཀྱི་ས་ཟེར་ན། སྔགས་དང་འབྲེལ་སོང་བ་རེད། དེ་ཁྱབ་ཀི་ཡོད་མ་རེད་ཟེར་གོ་རེད།
STT_NW0032_0086_567437_to_572142,ཁྱོན་ཆེན་པོ་གནང་ནས་མཐའ་མའི་སྤྱི་འཐུས་རྒྱུན་ལས་ཀིས་ཡང་ག་རེ་ཟེར་དགོས་རེད།  ,khyon chen po gnang nas mtha' ma'i spyi 'thus rgyun las kis yang ga re zer dgos red/__,https://d38pmlk0v88drf.cloudfront.net/wav16k/STT_NW0032_0086_567437_to_572142.wav,STT_NW,2,73,4.705,wav16k/STT_NW0032_0086_567437_to_572142.wav,ཁྱོན་ཆེན་པོ་གནང་ནས་ མཐའ་མའི་སྤྱི་འཐུས་རྒྱུན་ལས་ཀིས་ཡང་ག་རེ་ཟེར་དགོས་རེད་ད།
STT_NW0032_0087_572142_to_576734,སྙན་ཐོ་གཅིག་དེ་རིང་གྲོས་ཚོགས་ནང་ལ་ཡ་འབུལ་གི་རེད། ལ་འོ། དེ་གཅིག་བསླེབ་ཀི་རེད།  ,snyan tho gcig de ring gros tshogs nang la ya 'bul gi red/_la 'o/_de gcig bsleb ki red/__,https://d38pmlk0v88drf.cloudfront.net/wav16k/STT_NW0032_0087_572142_to_576734.wav,STT_NW,2,78,4.592,wav16k/STT_NW0032_0087_572142_to_576734.wav,སྙན་ཐུང་གཅིག་དེ་རིང་གྲོས་ཚོགས་ནང་ལ་ཡ་འབུལ་གི་རེད་ ལག་འོ། དེ་གཅིག་སླེབས་ཀི་རེད།
STT_NW0032_0088_576734_to_580948,ད་ད་ལྟ་ མང་གཙོ་རྩིས་ཁྲའི་ཚོགས་ཆུང་གི་ ,da da lta _mang gtso rtsis khra'i tshogs chung gi _,https://d38pmlk0v88drf.cloudfront.net/wav16k/STT_NW0032_0088_576734_to_580948.wav,STT_NW,2,38,4.214,wav16k/STT_NW0032_0088_576734_to_580948.wav,ད་ད་ལྟ་མང་གཙོ་རྩིས་གྲའི་ཚོགས་ཆུང་གི་
STT_NW0032_0089_580948_to_586576,ལས་བསྡོམས་སྙན་ཐོ་དང་འབྲེལ་བའི་ཐོག་ནས་ཨེ་ནས་ད་དུང་ནོར་གླིང་བོད་ཀྱི་རིག་གཞུང་གཅེས་སྐྱོང་ཁང་གི་ ,las bsdoms snyan tho dang 'brel ba'i thog nas e nas da dung nor gling bod kyi rig gzhung gces skyong khang gi _,https://d38pmlk0v88drf.cloudfront.net/wav16k/STT_NW0032_0089_580948_to_586576.wav,STT_NW,2,93,5.628,wav16k/STT_NW0032_0089_580948_to_586576.wav,ལེགས་བསྡོམས་སྙན་ཐོ་དང་འབྲེལ་བའི་ཐོག་ནས་ཨེ་ནས་ད་ལྟ་ནོར་གླིང་བོད་ཀི་རིག་གཞུང་གཅེས་སྐྱོང་ཁང་གི་
STT_NW0032_0090_586576_to_592607,རྩིས་ཁྲའི་གནས་སྟངས་སྤྱི་ཡོངས་ལ་ཞིབ་འཇུག་གནང་ཡ་གི་དེའི་ཐོག་ལ་གྲོས་ཚོགས་སྔོན་མའི་ཐོག་ལ་གྲོས་ཆོད་བྱུང་ཡོད་རེད།  ,rtsis khra'i gnas stangs spyi yongs la zhib 'jug gnang ya gi de'i thog la gros tshogs sngon ma'i thog la gros chod byung yod red/__,https://d38pmlk0v88drf.cloudfront.net/wav16k/STT_NW0032_0090_586576_to_592607.wav,STT_NW,2,109,6.031,wav16k/STT_NW0032_0090_586576_to_592607.wav,རྩིས་ཁྲའི་གནས་སྟངས་སྤྱི་ཡོངས་ལ་ཞིབ་འཇུག་གནང་ཡ་གི་དེའི་ཐོག་ལ་ཡ། གྲོས་ཚོགས་སྔོན་མའི་ཐོག་ལ་གྲོས་ཆོད་ཅིག་བྱུང་ཡོད་རེད།
STT_NW0032_0091_592607_to_601531,བྱས་ཙང་། གྲོད་ཆོད། གྲོས་ཆོད་བྱུང་པ་དེའི་ཐོག་ནས་ད། ཚོགས་ཆུང་སོ་སོར་བཙུགས་ན། ཚོགས་ཆུང་བཙུགས་པའི་ཨེ་ནས་སྙན་ཐོ་གཅིག་ ,byas tsang /_grod chod/_gros chod byung pa de'i thog nas da/_tshogs chung so sor btsugs na/_tshogs chung btsugs pa'i e nas snyan tho gcig _,https://d38pmlk0v88drf.cloudfront.net/wav16k/STT_NW0032_0091_592607_to_601531.wav,STT_NW,2,113,8.924,wav16k/STT_NW0032_0091_592607_to_601531.wav,བྱས་ཙང་གྲོས་ཚོ གྲོས་ཆོད་བྱུང་པ་དེའི་ཐོག་ནས་ད་ཚོགས་ཆུང་སོ་བཙུགས་གནང་། ཨེ་ནས་དེ་ཚོགས་ཆུང་བཙུགས་པའི་ཨེ་ནས་སྙན་ཐུ་གཅིག་
STT_NW0032_0092_601531_to_610478,ད་རེས་གྲོས་ཚོགས་ནང་ལ་བསླེབ་ཀི་རེད། དེ་བྱས། ད་ག་ནང་བཞིན་གིས་ད་ལྟ་གྲོས་ཚོགས་ཕལ་ཆེར་ཚོགས་དུས་ ,da res gros tshogs nang la bsleb ki red/_de byas/_da ga nang bzhin gis da lta gros tshogs phal cher tshogs dus _,https://d38pmlk0v88drf.cloudfront.net/wav16k/STT_NW0032_0092_601531_to_610478.wav,STT_NW,2,91,8.947,wav16k/STT_NW0032_0092_601531_to_610478.wav,ད་རིང་གྲོས་ཚོགས་ནང་ལ་སླེབས་ཀི་རེད། དེ་བྱས་ད་ག་ནང་བཞིན་གི་ད་ལྟ་གྲོས་ཚོགས་ཕལ་ཆེར་ཚོགས་དུའ་
STT_NW0032_0093_610478_to_611975,བརྒྱད་པའི་སྐབས་ལ་ཡིན་པ་ཡོད།  ,brgyad pa'i skabs la yin pa yod/__,https://d38pmlk0v88drf.cloudfront.net/wav16k/STT_NW0032_0093_610478_to_611975.wav,STT_NW,2,29,1.497,wav16k/STT_NW0032_0093_610478_to_611975.wav,རྒལ་པའི་སྐབས་ལ་ཡིན་པ་ཡོད།
STT_NW0032_0094_611975_to_621974,ཚོགས་དུས་བརྒྱད་པའི་སྐབས་ལ་ད་ལྟ། ད་ལྟ་ང་ཚོའི་བོད་མིའི་སྒྲིག་འཛུགས་ཀི་ཤེས་ཡོན། ཤེས་ཡོན་སྲིད་ཇུས་དང་འབྲེལ་བའི་ཐོག་ལ་ཚོགས་ཆུང་གཅིག། གྲོས་ཚོགས་ཀིས་ཆེད་འཛུགས་ཚོགས་ཆུང་གཅིག་བཙུགས་གནང་ཡོད་རེད།  ,tshogs dus brgyad pa'i skabs la da lta/_da lta nga tsho'i bod mi'i sgrig 'dzugs ki shes yon/_shes yon srid jus dang 'brel ba'i thog la tshogs chung gcig/_gros tshogs kis ched 'dzugs tshogs chung gcig btsugs gnang yod red/__,https://d38pmlk0v88drf.cloudfront.net/wav16k/STT_NW0032_0094_611975_to_621974.wav,STT_NW,2,186,9.999,wav16k/STT_NW0032_0094_611975_to_621974.wav,ཚོགས་དུ་བརྒྱད་པའི་སྐབས་ལ་ད་ལྟ། ད་ལྟ་ང་ཚོས་བོད་མིའི་སྒྲིག་འཛུགས་ཀི་ཤེས་ཡོན། ཤེས་ཡོན་སྲིད་ཇུས་དང་འབྲེལ་བའི་ཐོག་ལ་ཡཚོགས་ཆུང་གཅིག་གྲོས་ཚོགས་ཀི་སྤྱི་ཚུགས་ཚོགས་ཆུང་ག་ིག་གཙུགས་གནང་ཡོད་རེད།
STT_NW0032_0095_621974_to_624763,ཨོ་དེའི་ཐོག་ལ་ཡ་ད་ ,o de'i thog la ya da _,https://d38pmlk0v88drf.cloudfront.net/wav16k/STT_NW0032_0095_621974_to_624763.wav,STT_NW,2,19,2.789,wav16k/STT_NW0032_0095_621974_to_624763.wav,འོ་དེའི་ཐོག་ལ་ཡ་ད་
STT_NW0032_0096_624763_to_634762,གྲོས་ཚོགས་གཅིག། ལོ་གཅིག་གི་ནང་ཚུད་ལ་གང་ལྟར་སྙན་ཐོ་འབུལ་ཡ་གནང་བྱས། ད་ད་རེས་ད་ཤེས་ཡོན་ཚོགས་ཆུང་དང་འབྲེལ་བའི་ཚོགས་ཆུང་གི་སྙན་ཐོ་དེ་འབུལ་ཡ་གི་དུས་ཚོད་དེ་ད་རེས་བྱས་ནས་ ,gros tshogs gcig/_lo gcig gi nang tshud la gang ltar snyan tho 'bul ya gnang byas/_da da res da shes yon tshogs chung dang 'brel ba'i tshogs chung gi snyan tho de 'bul ya gi dus tshod de da res byas nas _,https://d38pmlk0v88drf.cloudfront.net/wav16k/STT_NW0032_0096_624763_to_634762.wav,STT_NW,2,163,9.999,wav16k/STT_NW0032_0096_624763_to_634762.wav,གྲོས་ཚོགས་གཅིག་། ལོ་གཅིག་ནང་ཚུལ་ལ་གང་ལྟར་སྙན་ཐོ་འབུལ་ཡ་གནང་བྱས། ད་ད་རིང་ད་ཤེས་ཡོན་ཚོགས་ཆུང་དང་འབྲེལ་བའི་ཚོགས་ཆུང་གི་སྙན་ཐོ་དེ་འབུལ་ཡ་གི་དུས་ཚོད་དེ་ད་རེང་བྱས་ནས་
STT_NW0032_0097_634762_to_636713,གྲོས་ཚོགས་རང་ཕུལ་ཡ་གྲ་སྒྲིག་བྱས་ཡོད་རེད།  ,gros tshogs rang phul ya gra sgrig byas yod red/__,https://d38pmlk0v88drf.cloudfront.net/wav16k/STT_NW0032_0097_634762_to_636713.wav,STT_NW,2,42,1.951,wav16k/STT_NW0032_0097_634762_to_636713.wav,གྲོས་ཚོགས་རང་ཕུལ་ཡ་གྲ་སྒྲིག་བྱས་ཡོད་རེད།
STT_NW0032_0098_636713_to_646301,དེ་འདྲས་ཡོད་རེད། ད་ག་ནང་བཞིན་གིས། ད་ལྟ་ང་རང་ཚོའི་ཆེས་མཐོ་སྨན་པའི་ལྷན་ཚོགས་དེའི་གནས་སྟངས་དེ། ད་གཅིག། ག་རེ་ཟེར་དགོས་རེད།  ,de 'dras yod red/_da ga nang bzhin gis/_da lta nga rang tsho'i ches mtho sman pa'i lhan tshogs de'i gnas stangs de/_da gcig/_ga re zer dgos red/__,https://d38pmlk0v88drf.cloudfront.net/wav16k/STT_NW0032_0098_636713_to_646301.wav,STT_NW,2,120,9.588,wav16k/STT_NW0032_0098_636713_to_646301.wav,དེ་འདྲས་ཡོད་རེད། ཨེ་ནས་ད་ག་ནང་བཞིན་གི་ད་ལྟ་ང་རང་ཚོའི་ཆོས་མཐོས་སམིན་པའི་ལྷན་ཚོགས་དེའི་གནས་སྟངས་དེ་ ད་གཅིག་ག་རེ་ཟེར་དགོས་རེད།
